created_at,indexed_at,text,author_handle,author_display_name,author_did,like_count,repost_count,reply_count,uri,cid,financial_score,top_topics,top_scores,finbert_sentiment,finbert_score
2026-05-01T18:47:03.825Z,2026-05-01T18:47:06.173Z,major science groups and former astronauts urge congress to reject trumps proposed cuts to nasa,newnarrative.bsky.social,Mike Walker,did:plc:kyvvwelbhtlncyo7j5de3org,0,0,0,at://did:plc:kyvvwelbhtlncyo7j5de3org/app.bsky.feed.post/3mkss2whvnc2l,bafyreib4wbhhqhbk3vxsmkfdtsveimhzitswk4vpndwl6wvrlxgogmzry4,0.5490608811378479,"['derivatives', 'crypto']","[0.5490608811378479, 0.5064792037010193]",neutral,0.5850441455841064
2026-05-01T18:28:41.140Z,2026-05-01T18:28:42.273Z,a o kt rej chodz kury spa,dziadzia.bsky.social,Dziadek Marek,did:plc:jjnf7v3hvuifeilipqpin7xl,0,0,1,at://did:plc:jjnf7v3hvuifeilipqpin7xl/app.bsky.feed.post/3mksr22ults2v,bafyreic2agos6civwjpba5pj5poc77cxcysvfzllcoybthiwng7st6zchy,0.5411327481269836,"['crypto', 'derivatives']","[0.5411327481269836, 0.5271482467651367]",neutral,0.8830913305282593
2026-05-01T18:03:58.252Z,2026-05-01T18:04:00.877Z,impeach trump,capecodcritter.bsky.social,CapeCodCritter,did:plc:v4gnaxe2o5khcj7xcvhdcfc5,7,6,1,at://did:plc:v4gnaxe2o5khcj7xcvhdcfc5/app.bsky.feed.post/3mkspnuohz22j,bafyreihadldt3t7wgpcrpnnvwhyv5uxym4wt2yuywrrept67ll27nljnce,0.5325120687484741,"['macro', 'equities']","[0.5325120687484741, 0.51075679063797]",negative,0.6613174080848694
2026-05-01T17:48:09.417Z,2026-05-01T17:48:12.373Z,marek chodzi spa z kurami,doramela.bsky.social,Doreen,did:plc:3fe3n7hg45laguad2onb42br,2,0,2,at://did:plc:3fe3n7hg45laguad2onb42br/app.bsky.feed.post/3mksorlsddc25,bafyreigtn3fewnpqekryvz33pi6bjyp3whtm4gzjv33nvmd3seqynlh6iy,0.5446939468383789,"['crypto', 'derivatives']","[0.5446939468383789, 0.540137529373169]",neutral,0.8577276468276978
2026-05-01T17:32:34.938Z,2026-05-01T17:32:35.174Z,gdzie tam dobranoc wszak s o ce jeszcze wysoko ptaki piewaj g o no i spac nie daj dziadku marku,1urszula.bsky.social,Urszula,did:plc:w42nxesoatyt4ph3437dhxn5,1,0,2,at://did:plc:w42nxesoatyt4ph3437dhxn5/app.bsky.feed.post/3mksnvqmc6k23,bafyreiauxecbzicuv5h2uczp5wlscqjnjuuy4lpjzl5fjkwb7uy4byu2fy,0.5277315974235535,"['forex', 'crypto']","[0.5277315974235535, 0.508173406124115]",neutral,0.8083576560020447
2026-05-01T16:51:12.023Z,2026-05-01T16:51:14.971Z,the planetary society led a coalition letter with 23 organizational signatories calling for the rejection of draconian cuts to nasa and science in fy 2027 proposed by the white house coverage here letter pdf in comments,caseydreier.bsky.social,Casey Dreier,did:plc:3mnvqdcgqyw5eituqeshtm6a,9,2,1,at://did:plc:3mnvqdcgqyw5eituqeshtm6a/app.bsky.feed.post/3mksllqpri22o,bafyreidqi4wie6tpnqno2xipqk4bplu6xqlan5vlkslzy2ymxx4kj2wc3y,0.5344574451446533,"['crypto', 'derivatives']","[0.5344574451446533, 0.5278956294059753]",neutral,0.8864444494247437
2026-05-01T16:18:33.597Z,2026-05-01T16:18:34.872Z,space junk gizmodocomastrayspac,jennbarrigar.bsky.social,Anne Nonymous,did:plc:l4odhrpr4yumghdoqv3qhz5y,0,0,0,at://did:plc:l4odhrpr4yumghdoqv3qhz5y/app.bsky.feed.post/3mksjrezc522s,bafyreicuj6um7qybtgvru7rcvxqecsuf2ea6jk5i2x57v3qs2kh6mwxlrq,0.5136863589286804,"['equities', 'derivatives']","[0.5136863589286804, 0.5133443474769592]",neutral,0.9378654360771179
2026-05-01T15:45:50.363Z,2026-05-01T15:45:50.777Z,theyre lying but hey we expect dishonesty out of anthony gramuglias entourage bskyappprofilespac,saiscribbles.bsky.social,,did:plc:sesozmtbltk2ktg7whfa7e5h,1,1,1,at://did:plc:sesozmtbltk2ktg7whfa7e5h/app.bsky.feed.post/3mkshwuq5gk2a,bafyreihcev6qt7nipbpxzzw3dkvcm4n43gosfuics3g56qsdfejbcxptgq,0.5531282424926758,"['equities', 'portfolio']","[0.5531282424926758, 0.5479975938796997]",neutral,0.6289405822753906
2026-05-01T15:29:10.143Z,2026-05-01T15:29:11.374Z,gizmodocomastrayspac,patentbuddy.bsky.social,Patent Buddy,did:plc:bgdrwipvjhtw7bofjxqbxg6o,1,0,0,at://did:plc:bgdrwipvjhtw7bofjxqbxg6o/app.bsky.feed.post/3mksgz2tu3k2r,bafyreibuucwa52fllwnjd7j2klkpskqo6dhydbe6skgrbqs6fptce3fjbm,0.5344752669334412,"['portfolio', 'equities']","[0.5344752669334412, 0.5248165130615234]",neutral,0.937049925327301
2026-05-01T15:11:03.105Z,2026-05-01T15:11:04.972Z,bskyappprofilespac explain,nomdugu.bsky.social,Mr. Smartass,did:plc:pa5njxshbednagssvotjnhxx,0,0,2,at://did:plc:pa5njxshbednagssvotjnhxx/app.bsky.feed.post/3mksfyo63k22a,bafyreifhyeds4h2xillannbchxytjpmc34iqwk3hiv4rkir2c6q2od2uk4,0.5789237022399902,"['portfolio', 'equities']","[0.5789237022399902, 0.5593629479408264]",neutral,0.9338976740837097
2026-05-01T13:49:07.957Z,2026-05-01T13:49:05.786Z,theres a very unpopular podcast with elons inner circle spac king and other grifters called all in since its inception the subreddit has been negative so they made a safespace one,past-frog2026.bsky.social,,did:plc:aak7f3s2smg7nxwmrtajdah3,1,0,0,at://did:plc:aak7f3s2smg7nxwmrtajdah3/app.bsky.feed.post/3mksbg6ppcc2z,bafyreiabhgzam6lxjdyfiecaq3rb2jnz2fmeuwgp36ucqdgndbstifwv4q,0.5673010349273682,"['crypto', 'equities']","[0.5673010349273682, 0.5145571827888489]",negative,0.9243370890617371
2026-05-01T12:59:48.575Z,2026-05-01T12:59:50.474Z,hamp hampaierts23spac,inaka61.bsky.social,小一郎,did:plc:dngudba52wjai3ah62ykh3o6,1,0,0,at://did:plc:dngudba52wjai3ah62ykh3o6/app.bsky.feed.post/3mks6nygitk2j,bafyreiaskrfhksu6r3cnuoee4yzsncvy7iznmq3ad33kz3xn7ljpl2l6fy,0.5600084066390991,"['forex', 'crypto']","[0.5600084066390991, 0.5525504350662231]",neutral,0.9340100884437561
2026-05-01T12:41:48.980Z,2026-05-01T12:41:49.974Z,instead of fighting discover try for you a feed based on your likes bskyappprofilespac,spacecowboy17.bsky.social,spacecowboy,did:plc:3guzzweuqraryl3rdkimjamk,0,0,1,at://did:plc:3guzzweuqraryl3rdkimjamk/app.bsky.feed.post/3mks5nstuts2g,bafyreifqeinftna6w57456pznavfhsfawvpgko6oxpbnwdedzhr26qemsq,0.5925998687744141,"['equities', 'portfolio']","[0.5925998687744141, 0.5779763460159302]",neutral,0.9270616173744202
2026-05-01T12:19:51.854Z,2026-05-01T12:19:56.675Z,bill gurley jack altman back startup pursuit which helps companies sell to government ai startup pursuit raises 22m to simplify government sales and unlock public contract opportunities for companies details,techticia.bsky.social,Tech Ticia ,did:plc:ggftwcrb3jxn4uuxvtorqeup,2,0,1,at://did:plc:ggftwcrb3jxn4uuxvtorqeup/app.bsky.feed.post/3mks4gkqfxk2b,bafyreiheyyievjkdt5lbeped55hqsdm5mr5qkqz6chdofme5zcbqs4idbu,0.6144569516181946,"['crypto', 'macro']","[0.6144569516181946, 0.5816322565078735]",positive,0.7706612944602966
2026-05-01T10:45:17.053Z,2026-05-01T10:45:17.471Z,little worried about spac with it being the 74 weekend and that it is just gonna be straight up goontz and high energylow creativity jams something about that place that brings it out of musicians but still nervous since it will be an expensive weekend,letterbomber.bsky.social,Matt,did:plc:654qyf2t4chvuv6jfaq2atdk,1,0,0,at://did:plc:654qyf2t4chvuv6jfaq2atdk/app.bsky.feed.post/3mkrx5gt7522e,bafyreidwgqcvgkvzmyhkju3adbwmnhwjkislvqgtxnorg63u6dmsthqk3a,0.5624690651893616,"['crypto', 'derivatives']","[0.5624690651893616, 0.552510678768158]",neutral,0.8244059085845947
2026-05-01T09:49:44.193Z,2026-05-01T09:49:46.977Z,kto nie pi po to aby spa m g kto,gdzie.eurosky.social,Grzesiek Dzięgielewski,did:plc:ns2pxai6dz7shym2zcmwboca,2,0,1,at://did:plc:ns2pxai6dz7shym2zcmwboca/app.bsky.feed.post/3mkru24ef2223,bafyreiapa5xiz5atbz3xrdo7vpouwibljo6ojpnn4jiimvgcwz6svxwiji,0.570228636264801,"['crypto', 'macro']","[0.570228636264801, 0.5441661477088928]",neutral,0.9064913988113403
2026-05-01T07:30:31.641Z,2026-05-01T07:30:32.174Z,markets edge funding buzzfeed priced its spac merger at 15b valuation the content factory just became a public company lets see which advertiser actually shows up,huanggoodman.bsky.social,huanggoodman.bsky.social,did:plc:4cbl6umgs55iakgqnvtbm2l4,0,0,0,at://did:plc:4cbl6umgs55iakgqnvtbm2l4/app.bsky.feed.post/3mkrmb76lbv2q,bafyreibxssjkb2j2cfgsot265uhrse6yuqmucbhfnyrsgiigj4avhjeojy,0.6379668116569519,"['crypto', 'macro']","[0.6379668116569519, 0.5809287428855896]",neutral,0.9078857898712158
2026-05-01T05:09:34.613Z,2026-05-01T05:09:45.573Z,read more technovahubsblogspotcom202604spac,technovahubs.bsky.social,,did:plc:7m3o6lhpvwbwvdpkqij4ldse,0,0,0,at://did:plc:7m3o6lhpvwbwvdpkqij4ldse/app.bsky.feed.post/3mkref5iuhc2x,bafyreihubjirryv63h4rivzsxw6jkj5awl2afjcr7uzktq4qbqcgexh3ge,0.5306068062782288,"['crypto', 'equities']","[0.5306068062782288, 0.5220426917076111]",neutral,0.936550498008728
2026-05-01T03:28:46.930Z,2026-05-01T03:28:47.775Z,again worse with citizens united and spac anonymous donors the wealthy have always tried to buy that influence,skyla50.bsky.social,,did:plc:hdnhvtvqk6nhgt6elsktkbwl,2,0,0,at://did:plc:hdnhvtvqk6nhgt6elsktkbwl/app.bsky.feed.post/3mkr6qvy35c2i,bafyreidolhejq2rwwtq5uiyytqrpfyern5rje45rqlmcd77vpjifqy3e7u,0.5942791700363159,"['crypto', 'macro']","[0.5942791700363159, 0.565998911857605]",neutral,0.799338161945343
2026-05-01T03:07:19.229Z,2026-05-01T03:07:18.974Z,last the wedge opener 732016 spac phish,harpua.bsky.social,bulldog,did:plc:p5arpzsgrom3icxxcmalkcn2,5,1,0,at://did:plc:p5arpzsgrom3icxxcmalkcn2/app.bsky.feed.post/3mkr5kjwkn22f,bafyreif7o2bsvl6buhg73roxofl3wuguanl756zsgae4sbicpmabjc6pum,0.5584287047386169,"['equities', 'derivatives']","[0.5584287047386169, 0.5429561734199524]",neutral,0.9047548174858093
2026-05-01T03:03:50.000Z,2026-05-01T03:16:47.773Z,re the starship i risk sending a thread off topic homeless posts thread 2 quote from spacelizard on today at 1252 am quote from greybeardengineer on today at 1233 am quote from spac spacex starship program origin interest match,spacex.activitypub.awakari.com.ap.brid.gy,spacex,did:plc:stcjaibae5ydvgzeruyvpviu,0,0,0,at://did:plc:stcjaibae5ydvgzeruyvpviu/app.bsky.feed.post/3mkr627xgf6j2,bafyreid6b2goieeu3fzvglobwa2v6joitc3zcxd4xrkrwk7i2q6z7oplay,0.5693489909172058,"['derivatives', 'crypto']","[0.5693489909172058, 0.5557549595832825]",neutral,0.9228605031967163
2026-05-01T02:37:12.686Z,2026-05-01T02:37:13.575Z,oh hell yes he should go on the next rocket his body would fall apart during the launch which is for the best i don t think a fellow astronaut would like to change his poopy diapers plus do they have space hamberders space diet coke he could do science experiments like snorting a line in spac,gdub12.bsky.social,,did:plc:b6jsfgv2f2quzzjghetngye7,0,0,0,at://did:plc:b6jsfgv2f2quzzjghetngye7/app.bsky.feed.post/3mkr3up3bhk25,bafyreiatc43jhuxa5j54tpsziiorkyb7mttza3svqy56kkwjxyz4qqyfly,0.5272909998893738,"['derivatives', 'equities']","[0.5272909998893738, 0.5079501271247864]",neutral,0.9246792793273926
2026-05-01T02:19:12.529Z,2026-05-01T02:19:13.176Z,imagine trump steakscasinoairlineschoolnonprofitspaccrypto and surely these drones will explode and destroy the manufacturing plant and end in epic failure that will never be covered by fox news and their magat affiliates,cagrizzly.bsky.social,,did:plc:hxhdqk6v2hjdtovc7xupiwtf,0,0,0,at://did:plc:hxhdqk6v2hjdtovc7xupiwtf/app.bsky.feed.post/3mkr2uixho22h,bafyreibmrsde7vwqy3s4bualfovuwo3varu6sqsoz542j5vdwwpbsiabwe,0.5488699078559875,"['crypto', 'macro']","[0.5488699078559875, 0.5431824922561646]",neutral,0.5965480208396912
2026-05-01T02:17:36.669Z,2026-05-01T02:17:37.372Z,unfortunately such posts seem to game the algorithm by attracting a lot of likes try for you it should be better in this regard bskyappprofilespac,spacecowboy17.bsky.social,spacecowboy,did:plc:3guzzweuqraryl3rdkimjamk,0,0,0,at://did:plc:3guzzweuqraryl3rdkimjamk/app.bsky.feed.post/3mkr2rnk3ec2g,bafyreidf3z7bm5wdzcvdvqh5rg5b2m7duaq4cdlpqmehsdnzbbbl4br35a,0.5927269458770752,"['portfolio', 'equities']","[0.5927269458770752, 0.5757343769073486]",neutral,0.8552625179290771
2026-05-01T01:00:08+00:00,2026-05-01T01:00:13.473Z,one giant leap australia and spaceport australia join forces spac dr gabrielle m caswell space science school proposed for australia space science school planned for moree australia one giant,ufofeed.bsky.social,UFOFEED,did:plc:ybqkf2mtfbwx3qhga63mttja,0,0,0,at://did:plc:ybqkf2mtfbwx3qhga63mttja/app.bsky.feed.post/3mkqwhapess2s,bafyreicdfy6yfnibylxrxm3anjhfkfvbn7oxbkxuflh55dcp3x3g3tswku,0.5424993634223938,"['forex', 'crypto']","[0.5424993634223938, 0.5160034894943237]",neutral,0.8983945250511169
2026-05-01T00:32:50.209Z,2026-05-01T00:33:06.471Z,gizmodocomastrayspac spacex still just dumping its trash wherever it wants,nomorebillionairs.bsky.social,MisspellerOfOwnName,did:plc:6r36knxxkmkshbu65qh7c5jz,0,0,0,at://did:plc:6r36knxxkmkshbu65qh7c5jz/app.bsky.feed.post/3mkquwcckbc2z,bafyreihtdstzbtpzmzwm5h3uxbeea5s46dft6pcvjubjqpa7jk6peb37iq,0.5551621913909912,"['equities', 'portfolio']","[0.5551621913909912, 0.5212924480438232]",neutral,0.8788236379623413
2026-05-01T00:01:11.484Z,2026-05-01T00:01:11.980Z,i think this is really setting up for a special summer run with the two night runs and amazing venues spac msg etc 2,joshuadomagala.bsky.social,Joshua Domagala,did:plc:iijsjubyiohrtscbb374pcrk,0,0,1,at://did:plc:iijsjubyiohrtscbb374pcrk/app.bsky.feed.post/3mkqt5pjzns2l,bafyreibrkcnec6mop5i56ypgxp2zs3bn5dj62jegc7krkqrcof2p4ymkqu,0.5778399109840393,"['equities', 'portfolio']","[0.5778399109840393, 0.5715522766113281]",neutral,0.8379685878753662
2026-04-30T23:54:41.130Z,2026-04-30T23:54:39.072Z,try for you bskyappprofilespac,spacecowboy17.bsky.social,spacecowboy,did:plc:3guzzweuqraryl3rdkimjamk,1,0,0,at://did:plc:3guzzweuqraryl3rdkimjamk/app.bsky.feed.post/3mkqss3bfkk25,bafyreiazj2zqjztnawxwd2hkj4hoiwxpivkaixwwjsjj75xostm62pvibq,0.5794650912284851,"['portfolio', 'equities']","[0.5794650912284851, 0.5749504566192627]",neutral,0.9351198077201843
2026-04-30T23:51:37.199Z,2026-04-30T23:51:35.079Z,try for you bskyappprofilespac,spacecowboy17.bsky.social,spacecowboy,did:plc:3guzzweuqraryl3rdkimjamk,0,0,0,at://did:plc:3guzzweuqraryl3rdkimjamk/app.bsky.feed.post/3mkqsmluahk25,bafyreifpt26amxaaiiohqzc4agibnqsz7a7lbdzbkpnioerbmphzpk2iui,0.5794650912284851,"['portfolio', 'equities']","[0.5794650912284851, 0.5749504566192627]",neutral,0.9351198077201843
2026-04-30T23:46:14.521Z,2026-04-30T23:46:12.672Z,consider for you a feed based on your likes bskyappprofilespac,spacecowboy17.bsky.social,spacecowboy,did:plc:3guzzweuqraryl3rdkimjamk,0,0,0,at://did:plc:3guzzweuqraryl3rdkimjamk/app.bsky.feed.post/3mkqscy4w7c25,bafyreicbckt4zcwovzvk56p47hps6hy4jq3aslycmtmwxmqsrqnjvmpcbe,0.5987972617149353,"['equities', 'portfolio']","[0.5987972617149353, 0.5957216024398804]",neutral,0.9448102116584778
2026-04-30T23:42:54.993Z,2026-04-30T23:42:53.677Z,try for you bskyappprofilespac,spacecowboy17.bsky.social,spacecowboy,did:plc:3guzzweuqraryl3rdkimjamk,0,0,0,at://did:plc:3guzzweuqraryl3rdkimjamk/app.bsky.feed.post/3mkqs4ztvl225,bafyreif63cuqqnywgdhlolre7pafea3555kmcn3mpwrwlr3qd6uer5tvs4,0.5794650912284851,"['portfolio', 'equities']","[0.5794650912284851, 0.5749504566192627]",neutral,0.9351198077201843
2026-04-30T22:42:10.528Z,2026-04-30T22:42:12.883Z,gizmodocomastrayspac,gleebix.bsky.social,gleebix,did:plc:3fjrbeu3ccegtqjnov4ol7xx,0,0,0,at://did:plc:3fjrbeu3ccegtqjnov4ol7xx/app.bsky.feed.post/3mkqoqg7lrc2g,bafyreihwfswu4i3jfvz56lou55ftmynb42asmzvhtsro622j74tsmienea,0.5344752669334412,"['portfolio', 'equities']","[0.5344752669334412, 0.5248165130615234]",neutral,0.937049925327301
2026-04-30T22:15:15.002Z,2026-04-30T22:15:15.375Z,i was going to add i am stretched on your grave the kate rusby version but i ran out of spac,someblokeinahat.bsky.social,Some Bloke in a Hat,did:plc:nhqjv2fqlpn2w6k2eidug33r,0,0,0,at://did:plc:nhqjv2fqlpn2w6k2eidug33r/app.bsky.feed.post/3mkqnabjlpc2j,bafyreich6wva2uzxvu5tv3pgzpp2imsmuaigxqymnr4ikx5isyqpeqwq7q,0.544836163520813,"['portfolio', 'macro']","[0.544836163520813, 0.5101405382156372]",neutral,0.4937892258167267
2026-04-30T21:27:33.495Z,2026-04-30T21:27:35.310Z,heres a link for the for you feed bskyappprofilespac,desdarkdesigns.bsky.social,Despoina [Commissions Open],did:plc:om7wjqeuhyhsyjqxx6eycbrc,1,1,0,at://did:plc:om7wjqeuhyhsyjqxx6eycbrc/app.bsky.feed.post/3mkqkkyvihs2d,bafyreib2cxi3s24cm4ts5bvfdn6r72jygtkcl2x7zyr3eycscegax3ofru,0.581494152545929,"['portfolio', 'equities']","[0.581494152545929, 0.5790232419967651]",neutral,0.9443935751914978
2026-04-30T20:40:45.982Z,2026-04-30T20:40:49.972Z,pi knie zacz em maj wk na hacjendzie dzieci ju pi wnuki te to i dziadek idzie spa dobranoc z fb,dziadzia.bsky.social,Dziadek Marek,did:plc:jjnf7v3hvuifeilipqpin7xl,21,2,1,at://did:plc:jjnf7v3hvuifeilipqpin7xl/app.bsky.feed.post/3mkqhxd4wc22w,bafyreiegh4scnoiowftgtvlxkvetddvhki2bbjoe6lmxixm37chaklnaly,0.5253974199295044,"['derivatives', 'forex']","[0.5253974199295044, 0.5137330293655396]",neutral,0.8484827876091003
2026-04-30T19:30:54.754Z,2026-04-30T19:30:55.473Z,tired of worrying about youtube deleting your original video files ive found a solution thats been a total lifesaver contabo storage explorer it lets me store my source footage in the cloud so i can free up local disk spac,enarmedia.com,enarmedia,did:plc:7dhjrd6wmcpxlwypurmq74w6,0,0,0,at://did:plc:7dhjrd6wmcpxlwypurmq74w6/app.bsky.feed.post/3mkqe2gnzhr2x,bafyreihbcmuxf5bfkax3im23xvoww67uchco37aonbta2go6s24gdjdq3u,0.550033450126648,"['equities', 'derivatives']","[0.550033450126648, 0.542056679725647]",neutral,0.8602361083030701
2026-04-30T17:43:49.520Z,2026-04-30T17:43:50.473Z,weathercomsciencespac,reincarnated7x.bsky.social,,did:plc:b2yzethqlfhbohwtfbehz23c,0,0,0,at://did:plc:b2yzethqlfhbohwtfbehz23c/app.bsky.feed.post/3mkq62wi4os2z,bafyreiae5qlnelju2tpflhhzmkh5sut3tgmh5wfgq7kbyrvw4idq4zw3e4,0.5414358377456665,"['derivatives', 'portfolio']","[0.5414358377456665, 0.5110621452331543]",neutral,0.9425371289253235
2026-04-30T17:17:20.962Z,2026-04-30T17:17:27.778Z,wie ci z portugalskiego frontu dzisiaj metkowa y i pakowa y bluzki karla lagerfelda niech ona mi lepiej nie m wi co i ile to kosztuje bo ja tu zawa u dostaj jutro dzie wolny bo tam te wi to pracy kapibara posz a spa panie sprz taczki w hotelu tak j u o y y,joanna77058426.bsky.social,Aśka,did:plc:pa7t77k2ooywooqsuxsmi5d6,4,0,1,at://did:plc:pa7t77k2ooywooqsuxsmi5d6/app.bsky.feed.post/3mkq4lljhck2l,bafyreiduua5o2dtsrn3uapqddhovyirr3cinitnwxhjqma2au6iqfungvy,0.5130023956298828,"['forex', 'equities']","[0.5130023956298828, 0.5033202171325684]",neutral,0.8333824872970581
2026-04-30T17:04:04.101Z,2026-04-30T17:04:05.973Z,so zap energy announced a pivot to fission to us it looks like a pivot to spac deep dive below coralcarbonsubstackcompzapenergy,cb1814.bsky.social,Chris,did:plc:q7sa4pu2as3n72jyrfp7sqb5,2,0,1,at://did:plc:q7sa4pu2as3n72jyrfp7sqb5/app.bsky.feed.post/3mkq3ttkxvk2b,bafyreicw5qmkxhdkn6hrbgtaabv7vfvamvno3h4nrcvcfb567zkgm4a3hu,0.5359366536140442,"['crypto', 'forex']","[0.5359366536140442, 0.51728355884552]",neutral,0.8105610609054565
2026-04-30T17:02:43.547Z,2026-04-30T17:02:55.876Z,eu t falando bskyappprofilespac,felippekatan.bsky.social,Felippe Katan,did:plc:sixsdrga22mjkgixppjftkdu,1,0,1,at://did:plc:sixsdrga22mjkgixppjftkdu/app.bsky.feed.post/3mkq3rgqlwk2s,bafyreif7l35vm32p3tiezjp66eiaavn7p5ckzamb3bpebqmopnexiwt5ja,0.5684962272644043,"['crypto', 'portfolio']","[0.5684962272644043, 0.5553587675094604]",neutral,0.9089805483818054
2026-04-30T16:32:53.928Z,2026-04-30T16:32:54.275Z,hmmmmmmmmmmmmmm bskyappprofilespac,sponcon.bsky.social,dog on the spectrum,did:plc:7sdjstpb4ogwzfvq5vftkw2l,0,0,0,at://did:plc:7sdjstpb4ogwzfvq5vftkw2l/app.bsky.feed.post/3mkq243zs422g,bafyreidnrvztmrqc4amfp4nusbvddocekdniuvodb2zili453jubfet7ci,0.5818985104560852,"['portfolio', 'equities']","[0.5818985104560852, 0.5684567093849182]",neutral,0.9342390298843384
2026-04-30T16:08:38.127Z,2026-04-30T16:08:40.472Z,spacex managed to miss planet earth and is going to hit the moon instead gizmodocomastrayspac,catelli.bsky.social,Catelli,did:plc:uzwynznfsovoan2zfrcxbuy5,1,0,0,at://did:plc:uzwynznfsovoan2zfrcxbuy5/app.bsky.feed.post/3mkpyqpoahk2l,bafyreidctfkqiq3outrasfbrkumisbcxioosb46r5turesdydw5hanaxnq,0.543345034122467,"['equities', 'forex']","[0.543345034122467, 0.5422133207321167]",neutral,0.8601154685020447
2026-04-30T16:06:55.0820692Z,2026-04-30T16:06:55.373Z,nasdaq adopts enhanced spac ipo listing standards under both global market and capital market tiers,securitieslaw.bsky.social,Securities Law,did:plc:pfslomwx7xmjr2soppucnyee,0,0,0,at://did:plc:pfslomwx7xmjr2soppucnyee/app.bsky.feed.post/3mkpynngoae2o,bafyreiezsn3q7vbohxcvfegxfwflbd7hhitqwvxfmwdpdpntlwmfzqdqcy,0.6774736642837524,"['crypto', 'forex']","[0.6774736642837524, 0.6000421643257141]",neutral,0.8702090382575989
2026-04-30T16:00:28.112Z,2026-04-30T16:00:30.975Z,1 the receivers will detect and characterize emissions from groundbased radars tracking sats in geo 2 this is from the andromeda program formerly known as rgxx which in turn is taking gssaps place they gotta stop changing these names breakingdefensecom202604spac,vsamsondc.bsky.social,,did:plc:3mvgkfm6wnv65bj6qhbuvjvt,1,0,0,at://did:plc:3mvgkfm6wnv65bj6qhbuvjvt/app.bsky.feed.post/3mkpyc4ea5c2b,bafyreicbxcr7qyd37j4kpmo3q6qtjyby5immsyedrwlnt7okt73hulg3gu,0.5502142310142517,"['forex', 'derivatives']","[0.5502142310142517, 0.5359610319137573]",neutral,0.938892662525177
2026-04-30T15:34:31.328Z,2026-04-30T15:34:32.971Z,just in case you want to check the math for the movie project hail mary i like this web page because i usually just do star trek destinations it wasnt in the movie but the book said that they used an acceleration of 18g the movie was more emotional,flotsamm.bsky.social,MikeW,did:plc:kn4fcqe45guw3ti7ra7du7kv,0,0,1,at://did:plc:kn4fcqe45guw3ti7ra7du7kv/app.bsky.feed.post/3mkpwtpowc22x,bafyreiecmszharn3gmxrili5hwep7ytl6prudqqocncruzngnwumm5fzby,0.5627479553222656,"['portfolio', 'macro']","[0.5627479553222656, 0.5487451553344727]",neutral,0.9272887110710144
2026-04-30T12:24:44.728Z,2026-04-30T12:24:48.977Z,5 4 08a 2026 1000 2025 hampaierts23spac,bunbunmaru-np.com,水越柚耶🍁例大祭と08a,did:plc:vdhyucpwq57vilq5afhexp4s,5,7,0,at://did:plc:vdhyucpwq57vilq5afhexp4s/app.bsky.feed.post/3mkpmaelhq22f,bafyreihygvnty4gew6u3h5ldqrjwmrkdrelsgzjk35rw2iobnlhizxg7jm,0.5592624545097351,"['crypto', 'forex']","[0.5592624545097351, 0.5478421449661255]",neutral,0.9371999502182007
2026-04-30T10:26:33.475Z,2026-04-30T10:26:49.376Z,anhinga nie idzie spa z mokr g ow suszenie pi r po k pieli to stara w wkowa tradycja taka extradycja yjkolorowo birds birdwatching,gretzyngier.bsky.social,Robert Gretzyngier,did:plc:kbdxgvyxzlti745h6dbat7gu,15,0,0,at://did:plc:kbdxgvyxzlti745h6dbat7gu/app.bsky.feed.post/3mkpfmztmx22e,bafyreihiyl24hiz6t5qhr6q3d3ujcxlgdo2bvbp73orl3k6lgp73tkmjla,0.533258855342865,"['crypto', 'equities']","[0.533258855342865, 0.5171136856079102]",neutral,0.9015895128250122
2026-04-30T09:29:29.000Z,2026-04-30T09:29:56.175Z,czy si troch niewyspa em przez to e robi em to wczoraj zamiast spa no troch tak ale jaka to rado jak dzia a,deerbard.mstdn.io.ap.brid.gy,deerbard,did:plc:o2swd3ejspqlzbos6f7klt3d,0,0,0,at://did:plc:o2swd3ejspqlzbos6f7klt3d/app.bsky.feed.post/3mkpch7rrtm22,bafyreif4kbzkpmfony7pskv76wetqrffvfrcu3origt2ygakmfufgdsnju,0.5494532585144043,"['forex', 'crypto']","[0.5494532585144043, 0.5367375612258911]",neutral,0.7916867136955261
2026-04-30T08:44:24.774Z,2026-04-30T08:44:26.176Z,twenty one capital shares rise as tether pushes merger with strike elektron apr 30 2026 0743 utc tether has proposed that twenty one capital a nyselisted bitcoin treasury venture merge with strike and elektron energy tether twentyonecapital strike elektronenergy spacmerger,rwatimes.bsky.social,RWATimes.io,did:plc:553eofo6hvuxcsxo7qfidxjs,2,0,3,at://did:plc:553eofo6hvuxcsxo7qfidxjs/app.bsky.feed.post/3mkp7wfzu2r2x,bafyreiftpxriflzpyusd3idrjzh76dsv7jmu67snmyqe25e75kmkx4pj3m,0.6672337651252747,"['crypto', 'forex']","[0.6672337651252747, 0.6339521408081055]",positive,0.7957236170768738
2026-04-30T07:15:05+00:00,2026-04-30T07:15:09.873Z,catalyst partners middle east moves ahead with plan to acquire controlling stake in eih consulting catalyst partners middle east cpme egypt s first special purpose acquisition company spac has announced that its board has,europe-africa.bsky.social,,did:plc:v3lkb3m4lu6nzv6npkah6umc,0,0,0,at://did:plc:v3lkb3m4lu6nzv6npkah6umc/app.bsky.feed.post/3mkp2wqxb5v2n,bafyreihmmmut6fkz4xrky6372yg744lwzcr5syhalugf5yqozub4miu5i4,0.6232187151908875,"['forex', 'crypto']","[0.6232187151908875, 0.6190281510353088]",neutral,0.8487832546234131
2026-04-30T05:42:35.674Z,2026-04-30T05:42:36.274Z,dobranoc pora i ju spa do jutra,czerniecki.bsky.social,Zbigniew Czerniecki,did:plc:2ptgd6i4rxcsnh7oc2bugw57,1,0,0,at://did:plc:2ptgd6i4rxcsnh7oc2bugw57/app.bsky.feed.post/3mkovrbd5hc2e,bafyreia255y2vuxhdtqilerh7nx7wjk4wd67qkiozo6n3z6chmxge6flte,0.5295817255973816,"['derivatives', 'forex']","[0.5295817255973816, 0.5180118083953857]",neutral,0.8027365803718567
2026-04-30T04:42:16.664Z,2026-04-30T04:42:18.472Z,spac,bluebirdland.bsky.social,バードランド,did:plc:6vhucndoxj4zqjad74dxbt5n,0,0,0,at://did:plc:6vhucndoxj4zqjad74dxbt5n/app.bsky.feed.post/3mkosffxpys24,bafyreidjstc2wmko2tllhzmgzez5ukfhnokaagrbk3aprulhsird5lxm6a,0.5805454254150391,"['crypto', 'forex']","[0.5805454254150391, 0.5507660508155823]",neutral,0.9356943964958191
2026-04-30T02:24:45.964Z,2026-04-30T02:24:47.675Z,hall chadwick targets 265 million public offering to fund sustainable tech ventures,wsnext.com,Wall Street Next,did:plc:elcepvr65b7rymlyk4avyktc,0,0,0,at://did:plc:elcepvr65b7rymlyk4avyktc/app.bsky.feed.post/3mkokpjw4jc2v,bafyreihf7uov2odtnqljrturhjjm5h6lneuqtchuonjbjeczluknwycrwe,0.5887428522109985,"['crypto', 'portfolio']","[0.5887428522109985, 0.5614265203475952]",positive,0.5797759890556335
