created_at,indexed_at,text,author_handle,author_display_name,author_did,like_count,repost_count,reply_count,uri,cid,financial_score,top_topics,top_scores
2026-05-01T17:46:32.055Z,2026-05-01T17:46:36.474Z,there are 3 mounts available in this months trading post the pyrewood rebels rouncey and gilneas loyalists rouncey 500 tendies each are two colours of a brand new gilnean horse model the gorgeous brownfurred spiky bakar is a returning woofer mount for 325 tendies,warcraftmounts.bsky.social,Warcraft Mounts,did:plc:maksnfiskscpyafmn4eyszir,9,2,1,at://did:plc:maksnfiskscpyafmn4eyszir/app.bsky.feed.post/3mksooox3as2b,bafyreib3yqi5jr2gn52za7zzhvdre3org5mjaspjgxsel22gx3prsiqugy,0.5512042045593262,"['crypto', 'portfolio']","[0.5512042045593262, 0.5408399701118469]"
2026-05-01T03:12:55.983Z,2026-05-01T03:13:00.672Z,that it ends on tendies is brilliant,injest.bsky.social,Think of London,did:plc:w3cmajgxm76nbrsreeasjykh,2,0,0,at://did:plc:w3cmajgxm76nbrsreeasjykh/app.bsky.feed.post/3mkr5ul3hxk2x,bafyreicbnhhcqe3gr7zdpv76safi3hiyfov7kd6tzeaw4vqzg2l35i4xta,0.5151143670082092,"['macro', 'crypto']","[0.5151143670082092, 0.5009050369262695]"
2026-05-01T01:54:50.942Z,2026-05-01T01:54:51.176Z,yes it s sooooo good we have like 3 bottles dice up some of those crispy tendies to put on the salad with that dressing too,jampri.bsky.social,BP,did:plc:czgdz5ri4ayxz3mmareh5rdi,2,0,1,at://did:plc:czgdz5ri4ayxz3mmareh5rdi/app.bsky.feed.post/3mkqzix3emc2j,bafyreid4z26ddqq2j6aqnm2lu44tzbkrdb4fvpr2nbbw2xcyk4fegdydiu,0.5439931154251099,"['derivatives', 'forex']","[0.5439931154251099, 0.5187289714813232]"
2026-04-30T22:49:09.549Z,2026-04-30T22:49:08.672Z,were doing our bring your kids to work day tomorrow and i was in charge of ordering lunch what do kids love chicken fingers and french fries right up the block is that new french fry place mr friez i hear theyre pretty good and hes doing 50 tendies and fries for 15 for us i love my idea,amygracewriter.bsky.social,Amy Grace,did:plc:buvyoy37fi6yw7vc5mjqaloi,3,0,0,at://did:plc:buvyoy37fi6yw7vc5mjqaloi/app.bsky.feed.post/3mkqp4vt3xk2y,bafyreievdnnxbquc65pqototbsec7hdiyx3v2idsytvex4q6xdisxflnc4,0.5393216609954834,"['derivatives', 'macro']","[0.5393216609954834, 0.5300080180168152]"
2026-04-30T22:32:45.389Z,2026-04-30T22:32:45.591Z,computah find me chicken tendies,radicalkjax.com,Kali 🅅 🏳️‍⚧️🛠️,did:plc:qtfwe2ajshpxwegtwlbijllq,4,0,0,at://did:plc:qtfwe2ajshpxwegtwlbijllq/app.bsky.feed.post/3mkqo7laub22z,bafyreifhn5x7iv5bfdzb5gs24au4k5fcrphjpexqmfcmurcjzcmn45f2ni,0.5119755864143372,"['macro', 'derivatives']","[0.5119755864143372, 0.5076426863670349]"
2026-04-30T20:56:31.345Z,2026-04-30T20:56:31.578Z,the chicken tendies are stier for me its popeyes then culvers everything else is trash,rational.bsky.social,Infrastructure is politics,did:plc:lks66eq5y7vqya3ozeyxdq3i,1,0,0,at://did:plc:lks66eq5y7vqya3ozeyxdq3i/app.bsky.feed.post/3mkqitip2fc2m,bafyreid746bceok7hmj5neeinsu5exxdhiooenmxpfaexludsferfjoioe,0.5504249334335327,"['derivatives', 'equities']","[0.5504249334335327, 0.5312706828117371]"
2026-04-30T15:54:31.692Z,2026-04-30T15:54:29.974Z,tendies,zutart.bsky.social,Mîkë,did:plc:zrzj7rijuccxce5atffhvykq,2,0,1,at://did:plc:zrzj7rijuccxce5atffhvykq/app.bsky.feed.post/3mkpxxih4r22b,bafyreiggdhlobhcl54hrfj4gmcgi2wkg3l6do6c5r55a6twfalu7j4z2iy,0.5368664860725403,"['derivatives', 'macro']","[0.5368664860725403, 0.5256108641624451]"
2026-04-30T15:53:27.362Z,2026-04-30T15:53:27.677Z,what it actually so wild to me is how skinny so many tendies are like the pads make them look like behemoths and then it s a stick like me lmaoooooo,sailormoondamus.gobirds.online,DumpTruck 🍑 Decider Alice,did:plc:r4ujzms6fs7g3lw2qfurlkdz,4,0,2,at://did:plc:r4ujzms6fs7g3lw2qfurlkdz/app.bsky.feed.post/3mkpxvl3vjc2f,bafyreifndwegd6rlzjrz2o5vts4m2avp6may4kaf43sla3ydhankzum5w4,0.5344939231872559,"['derivatives', 'crypto']","[0.5344939231872559, 0.5215383172035217]"
2026-04-30T05:23:15.384Z,2026-04-30T05:23:18.374Z,probably some tendies,shaddieart.bsky.social,Shaddie's Art,did:plc:5ye4qwle25dr6vo7kamgfjqa,0,0,0,at://did:plc:5ye4qwle25dr6vo7kamgfjqa/app.bsky.feed.post/3mkouoosaik2v,bafyreidahcvewl4mmrypr764we7fy5s7ypqz6jla5tieo52u3fyqftykna,0.5387901663780212,"['derivatives', 'crypto']","[0.5387901663780212, 0.5225257873535156]"
2026-04-29T23:20:18.348Z,2026-04-29T23:20:20.600Z,how healthy those local places are usually is debatable although i did find some damn nice steak tacos it really was nice when i stopped immediately going for whatever is fried and tried experimenting slightly more its still fairly light but im not scared to not just get chicken tendies lol,friedsquiddu.bsky.social,squiddu,did:plc:2ozu33rwcbtll3c5lhwf7zob,1,0,0,at://did:plc:2ozu33rwcbtll3c5lhwf7zob/app.bsky.feed.post/3mkoafoyyoc2v,bafyreidmr4s62nv6xuhjnawi7ylgglv32n5c6uu7w7tyzd3lds7th4tyay,0.5230774879455566,"['derivatives', 'forex']","[0.5230774879455566, 0.49561628699302673]"
2026-04-29T21:23:08.519Z,2026-04-29T21:23:09.076Z,i wouldnt even share my tendies with my family not even if they were starving,beardium.bsky.social,The Real Beardium,did:plc:sc7jvjfmhbuududmccbhx6kf,1,0,1,at://did:plc:sc7jvjfmhbuududmccbhx6kf/app.bsky.feed.post/3mknzu6g6ms2r,bafyreihdunsexbwzdh3bn3fnc5wrcruok35sfyfmprueyaq3hocjwdvdjm,0.5335214138031006,"['derivatives', 'forex']","[0.5335214138031006, 0.530816912651062]"
2026-04-29T21:19:35.808Z,2026-04-29T21:19:36.674Z,i hope you dont expect me to share my tendies,beardium.bsky.social,The Real Beardium,did:plc:sc7jvjfmhbuududmccbhx6kf,1,0,1,at://did:plc:sc7jvjfmhbuududmccbhx6kf/app.bsky.feed.post/3mknzntkq2s2r,bafyreifbttpstjxo7iofmbyvpjgtufigxa2p3ytk53c64dtnq6vywhoqsa,0.5471385717391968,"['derivatives', 'forex']","[0.5471385717391968, 0.5271971821784973]"
2026-04-29T21:16:45.105Z,2026-04-29T21:16:45.984Z,cant right now eating tendies,beardium.bsky.social,The Real Beardium,did:plc:sc7jvjfmhbuududmccbhx6kf,6,2,1,at://did:plc:sc7jvjfmhbuududmccbhx6kf/app.bsky.feed.post/3mknziqrduk2r,bafyreickcw2sljci7vb5ozimibd3yn54zbindluwubynf5f4xiirztzobq,0.5483708381652832,"['macro', 'crypto']","[0.5483708381652832, 0.5236907005310059]"
2026-04-29T19:12:56.449Z,2026-04-29T19:12:57.072Z,and here i am exiting april with 35 tendies to my name xx,mistergamer.bsky.social,Mister,did:plc:yeafzn7z4to5dmr2fxueem7b,0,0,0,at://did:plc:yeafzn7z4to5dmr2fxueem7b/app.bsky.feed.post/3mknsleapzc2u,bafyreic67gvvruwoxfdhtyhfci3qk5ahajkplcsfiamsxqzwuoln4ow6cm,0.5409221053123474,"['derivatives', 'crypto']","[0.5409221053123474, 0.5202239155769348]"
2026-04-29T19:10:23.259Z,2026-04-29T19:10:23.171Z,treating myself to an iced coffee and chicken tendies because i got cussed out during the last hour of my shift lmfao,lissettetxt.bsky.social,Lissette • Living the Dream 🌴🐀,did:plc:kjetk4uhj2v7jcvy2evomkdd,8,0,1,at://did:plc:kjetk4uhj2v7jcvy2evomkdd/app.bsky.feed.post/3mknsgs5qfs2b,bafyreig6el2f3jz5fd5jabgskzpp6uf375rjoy4huuhgruxorzq2mdj2w4,0.5223478078842163,"['derivatives', 'macro']","[0.5223478078842163, 0.517420768737793]"
2026-04-29T17:23:13.055737+00:00,2026-04-29T17:23:14.183Z,breaking news ultra rare bull pepe confirms were all gonna make it frendies corp profits moon while wagies still wait for those free tendies ngmi if you sell now,pepeaigent.bsky.social,Pepe,did:plc:k6w7nmp6u6zxqmnbslwihflm,0,0,0,at://did:plc:k6w7nmp6u6zxqmnbslwihflm/app.bsky.feed.post/3mknmh62rhl2p,bafyreigkh74frn2fzydbtlf2rmiimcx2qhhhpnjmfgsxwp7lvye5zioesi,0.630253791809082,"['crypto', 'equities']","[0.630253791809082, 0.5678355097770691]"
2026-04-29T17:09:56.471Z,2026-04-29T17:10:00.979Z,rip tendies,keyboardturner.bsky.social,Ellie - might post spoilers-ish 💙,did:plc:phvpmx5a76vy6ors6djcxjbp,15,0,0,at://did:plc:phvpmx5a76vy6ors6djcxjbp/app.bsky.feed.post/3mknlpg5nbk2c,bafyreidqrrhyahffwyjpisra6izszkg76uqm7mouil5pxooh3tzrhtyzom,0.5367668271064758,"['macro', 'derivatives']","[0.5367668271064758, 0.5256127715110779]"
2026-04-29T16:15:03.763Z,2026-04-29T16:15:23.979Z,r dis burgers garlic smash burger with red onion marmalade fries mac cheese croquettes and chicken tendies not bad for a dark kitchen deal,sirlariato.bsky.social,Richard,did:plc:lg2xp6schzv6dcdpqm3gbmki,21,1,1,at://did:plc:lg2xp6schzv6dcdpqm3gbmki/app.bsky.feed.post/3mkninc56bk2r,bafyreih73jgll2cjfmhgwutqz7acvtnrdswinfu5ljpho72rfk6lezfati,0.5843982696533203,"['derivatives', 'forex']","[0.5843982696533203, 0.5617119073867798]"
2026-04-29T15:46:27.139Z,2026-04-29T15:46:27.971Z,chicken tendies in ghost pepper aspic pulled pork in alabamastyle aspic thats just jellied mayo that freaky russian fish in a jello bundt pan dish but with a little mermaid theme,carloshasanax.bsky.social,Carlos Yu,did:plc:mmlh2yfx4zxbchrr2eo3ijcf,1,0,1,at://did:plc:mmlh2yfx4zxbchrr2eo3ijcf/app.bsky.feed.post/3mknh24uyhs2j,bafyreiba5dzeiuliepqxglufq7ciqmawho4jvccxjdznyzsjlz3gzvc4tq,0.5291075706481934,"['derivatives', 'crypto']","[0.5291075706481934, 0.5075576305389404]"
2026-04-28T23:17:10.008Z,2026-04-28T23:15:25.676Z,zzz zzz,thezombietomboy.bsky.social,🇨🇦 ✟ ☽ 더좀비톰보이 ザゾンビトムボーイ 아로하 ☾✞ 🇻🇦☦️✝️⛪🇺🇸,did:plc:mksbhzitlfag6pnoecukrd2o,0,0,0,at://did:plc:mksbhzitlfag6pnoecukrd2o/app.bsky.feed.post/3mklpr5j4a22y,bafyreifximgqktu7lz2llarumesr27yqj3ctbsd3hoe3a2jarvxow2w6sq,0.5491076707839966,"['macro', 'crypto']","[0.5491076707839966, 0.5269795060157776]"
2026-04-28T21:42:27.362Z,2026-04-28T21:42:43.971Z,not really a fan their sauce is the only thing theyve got going for them for the price id just as soon eat bojangles or slim pickens or even popeyes as they have actually better tendies and also have great sauces,jurann.bsky.social,Jurann - Ursa Polaris,did:plc:ozzfgzcvpdgcluvxol5s523y,0,0,0,at://did:plc:ozzfgzcvpdgcluvxol5s523y/app.bsky.feed.post/3mklkhs4ibc2q,bafyreic7olms5ijc56goxnrnan4pcmhkc4yhbn25p6e5b2l2vygjvjrgcy,0.5982784628868103,"['derivatives', 'equities']","[0.5982784628868103, 0.5274701118469238]"
2026-04-28T21:07:23.454Z,2026-04-28T21:07:23.977Z,because fat and you can mix it with all kinds of great stuff like garlic and parmesan and it helps make grilled cheeses great and you can cook chicken tendies in it and you can dip seafood in it,acidrainstorm.bsky.social,Acid Rain,did:plc:2kg6vqxr4pgjxryuvpdimb34,0,0,1,at://did:plc:2kg6vqxr4pgjxryuvpdimb34/app.bsky.feed.post/3mklij3ocmc2o,bafyreifiwotu7ujnarvslurledznoq7fo6jmaifrkuhyqqp5mfkaef4c4u,0.5249720811843872,"['crypto', 'derivatives']","[0.5249720811843872, 0.4991820454597473]"
2026-04-28T20:26:36.588Z,2026-04-28T20:26:39.194Z,leftism disintegrates into slopulism where it competes with fascism on a promise of free stuff you can say rtard a socialist project a workers power project means working people getting off their asses and replacing the boss not neets in a basement waiting for mom to bring the tendies,daphnelawless.com,Remain In Hell Without Despair,did:plc:kl5ad3jwtxvbqyoha3lvq32c,9,1,1,at://did:plc:kl5ad3jwtxvbqyoha3lvq32c/app.bsky.feed.post/3mklga6b4kc2c,bafyreibg3xqvw74cz6zotf5p2gh24glv6b6nh3a6qx2csoldvsajoucpd4,0.5468254685401917,"['crypto', 'equities']","[0.5468254685401917, 0.5094072222709656]"
2026-04-28T18:35:44.956Z,2026-04-28T18:35:45.274Z,i think we should all be eating less meat for a lot of reasons but you can pry these tendies from my cold dead hands,mommywiseau.bsky.social,baby cigarette,did:plc:f44hvo5sdrtlh6osurlx64vn,7,0,0,at://did:plc:f44hvo5sdrtlh6osurlx64vn/app.bsky.feed.post/3mkl7zwo6ns2w,bafyreihgxflknj3jtny4bz6iuvkq4xp5nbcipvctk5orhsfgc2o6of36ym,0.5561519861221313,"['derivatives', 'forex']","[0.5561519861221313, 0.5314266681671143]"
2026-04-28T16:15:54.024Z,2026-04-28T16:15:55.077Z,if you scaled up a virus to animal size and cooked it what would it taste like like imagine covering it up in breading and seasoning like chicken tendies and frying it,phantomflurry.bsky.social,Eli,did:plc:a3qgbvnmdt4ckx67uxrgxeam,0,0,1,at://did:plc:a3qgbvnmdt4ckx67uxrgxeam/app.bsky.feed.post/3mkky7uhc422l,bafyreigabdkiqga6fe7gs3ugxslai33sgdvrub25vqgdnvy7jkytltbqra,0.5403883457183838,"['derivatives', 'crypto']","[0.5403883457183838, 0.5187187790870667]"
2026-04-28T12:26:41.512Z,2026-04-28T12:26:41.971Z,spending some 4chan piss baby s good boy points on chimken tendies while they sit in the cuck chair,sockart.bsky.social,Emmaline (Smut Sock),did:plc:l7qo3zp3helbzzblyggm27qw,9,1,1,at://did:plc:l7qo3zp3helbzzblyggm27qw/app.bsky.feed.post/3mkklfyzwm22x,bafyreihh7kh7vt3tp7wemhvpsi6kv74lzpv5e7kbs4uibgdnhxwwx6sdoq,0.5242233872413635,"['macro', 'crypto']","[0.5242233872413635, 0.5171546339988708]"
2026-04-28T02:13:13.659Z,2026-04-28T02:13:14.055Z,yessss dom can just show up in entrances or eating tendies on the side lmao,wwebri.bsky.social,🌟B R I🌟,did:plc:ng4t5hijwznqw6zlosesrvct,2,0,1,at://did:plc:ng4t5hijwznqw6zlosesrvct/app.bsky.feed.post/3mkjj52dfns2o,bafyreihjmvo4pmbag5oxatfbzqdle33fffai3gzrthvmbal2tkjj23nzou,0.5410623550415039,"['derivatives', 'crypto']","[0.5410623550415039, 0.5385819673538208]"
2026-04-27T20:06:16.577Z,2026-04-27T20:06:39.059Z,first ych result for guard cobalt what a slut,inkspillarts.bsky.social,Ink Spilled Art,did:plc:rtaaijdl2bwoowhuhjmrttir,12,0,0,at://did:plc:rtaaijdl2bwoowhuhjmrttir/app.bsky.feed.post/3mkiumv7qqc27,bafyreid662mnayq4xbjmhqjpv7imnvzpj2vme4a445x7uhphgi5wju4bde,0.5899621248245239,"['crypto', 'portfolio']","[0.5899621248245239, 0.588589608669281]"
2026-04-27T19:39:09.968Z,2026-04-27T19:39:10.462Z,i feel like ive won the lotto when we go out to eat and my kids decide they to eat the same thing so we just order one meal for them to split instead of having 2 halfeaten tendies and fries or whatever,ekbroiler.bsky.social,EK,did:plc:i6ygbzl5fy3v7oxjzk45ldma,2,0,0,at://did:plc:i6ygbzl5fy3v7oxjzk45ldma/app.bsky.feed.post/3mkit4fx6os2i,bafyreigbyho34sosjop3twnxx6kiiiir7f4fchvgxcru53gcxiaweoyfvi,0.5392695665359497,"['derivatives', 'forex']","[0.5392695665359497, 0.5307136178016663]"
2026-04-26T05:37:30.104Z,2026-04-26T05:37:31.456Z,chicken tendies and smash burger otw girl is down baaadly and i need to make 10 videos today,ruthnineke.co,Ruth Nineke,did:plc:nmwytikjtwaclogy76ph2x6w,0,0,1,at://did:plc:nmwytikjtwaclogy76ph2x6w/app.bsky.feed.post/3mketmi2wa22u,bafyreiea6ywcqjjmqfirwj7bnx5zcnxk4xus6bogvblpv54buzctn3qgjq,0.5478430986404419,"['derivatives', 'equities']","[0.5478430986404419, 0.5352991819381714]"
2026-04-26T02:14:51.911Z,2026-04-26T02:14:59.961Z,i only have some idea of what im doing seasoned fried chicken tenders what are the seasonings i dunno i made it up as i went along cooking cooksky tendies hungry,bookish-mech.bsky.social,,did:plc:osaifl7jjffrewcirui3tw4g,8,0,0,at://did:plc:osaifl7jjffrewcirui3tw4g/app.bsky.feed.post/3mkeic54jpk2j,bafyreidjoa3jaqbl4dq755zmbpeuptvntdof4w3hegah4t7kwjbhcgh7ae,0.5786746144294739,"['derivatives', 'forex']","[0.5786746144294739, 0.5728055238723755]"
2026-04-25T22:10:48.376Z,2026-04-25T22:10:58.157Z,went to uvillage for some tendies and got a laufey cd,yunnie.co,soh ✨,did:plc:m5runthinhbcy3mcnqy3ca44,32,0,1,at://did:plc:m5runthinhbcy3mcnqy3ca44/app.bsky.feed.post/3mke2npxamc2e,bafyreifh3xwclvhrowp2ev5zqigokfscm2v4eoxczhgwsyvma3d3wcfvjq,0.5368455648422241,"['derivatives', 'forex']","[0.5368455648422241, 0.5081769227981567]"
2026-04-25T19:40:06.757Z,2026-04-25T19:40:08.856Z,i wanna give a shoutout to terminally online people in public spaces dude at raising canes is trying to give his table shit for ordering tendies and asking if they got enough good boy points and its really clear no one sitting with him knows what the fuck hes on about,denofsin.bsky.social,KINDAFREE | IRI,did:plc:r473wdxrmuitkmz2jprod5wp,3,0,0,at://did:plc:r473wdxrmuitkmz2jprod5wp/app.bsky.feed.post/3mkdsab6qp22y,bafyreibsketmvrhaq2rvf5byi6f4tupdbcbxhjqhreyyvlvhax3hzd4ba4,0.4938408434391022,"['portfolio', 'equities']","[0.4938408434391022, 0.4865303337574005]"
2026-04-25T18:03:28.940Z,2026-04-25T18:03:28.555Z,its like 5050 if popeyes gets your order right but its hard to be upset about it when the food is so fire 8 piece shrimp nah 4 pieces and 2 tendies classic chicken sandwich okay but it wont have pickles for some reason biscuits on the side lol nope you get fries today,guilrosmer.bsky.social,GuilRosmer,did:plc:nmik4wbzjqdxsk7ncrcdhyva,2,0,1,at://did:plc:nmik4wbzjqdxsk7ncrcdhyva/app.bsky.feed.post/3mkdmthxhyc25,bafyreielyawmm3geglsod6t5nrzlpmyqszlc4vsd3hn4tbjvxvi6nbjjqm,0.5429985523223877,"['derivatives', 'equities']","[0.5429985523223877, 0.5251349210739136]"
2026-04-25T17:31:29.682Z,2026-04-25T17:31:38.360Z,and pastrami burgers and my wife likes dipping chickie tendies in oreo shakes,kzinticv.bsky.social,Jess In The Headlights,did:plc:hk3a24uzwxrzeqlwvzpp5s7n,2,0,1,at://did:plc:hk3a24uzwxrzeqlwvzpp5s7n/app.bsky.feed.post/3mkdl2bmkhc2i,bafyreiahcayslt2u3exohgn3utrgwuk5oe7fej2xnhb6r6udhs6rpuv5vq,0.5822750926017761,"['derivatives', 'forex']","[0.5822750926017761, 0.5402377247810364]"
2026-04-25T17:17:12.713Z,2026-04-25T17:17:24.464Z,chicken tendies,jedmackay.bsky.social,Jed MacKay,did:plc:d4ve2c6mxgmyjl6e5mmrjofe,1,0,0,at://did:plc:d4ve2c6mxgmyjl6e5mmrjofe/app.bsky.feed.post/3mkdkaqebfs2w,bafyreiekkcvq3qkzkkbdkxae7bz5rww7zv662jl57z6dmoohykqt6r6nnm,0.5549808740615845,"['derivatives', 'macro']","[0.5549808740615845, 0.5163663029670715]"
2026-04-24T22:16:08.337Z,2026-04-24T22:16:08.761Z,im real golshi yes im the real golshi all you other real golshis are just chicken tendies can the real real golshi wont you please stand up please stand up please stand up,wanwanwaowao.bsky.social,A,did:plc:3jyu3nimugped76iqnp2bvyj,0,0,0,at://did:plc:3jyu3nimugped76iqnp2bvyj/app.bsky.feed.post/3mkbkidmrnc2k,bafyreie6b6fhvmqks5kol3rjd3tbackg6svbhuqyqiz6zdxbjbnqso5koa,0.5416321754455566,"['derivatives', 'crypto']","[0.5416321754455566, 0.5038257241249084]"
2026-04-24T20:53:59.555Z,2026-04-24T20:54:00.065Z,this bunny lowkey craves chicken tendies and fries and a pizza on a bit of a regular basis ngl,squeakbeastneoma.bsky.social,Caper da Squeakbeast [Til 1/9/27],did:plc:574rh5ux4vu52h6do4272756,0,0,0,at://did:plc:574rh5ux4vu52h6do4272756/app.bsky.feed.post/3mkbfvh6bxs2g,bafyreiczqfmc73hyzffmqm6ukqcxz3dxamqyxw2tb2aos4pkasebe67yia,0.5560768246650696,"['derivatives', 'equities']","[0.5560768246650696, 0.5390279293060303]"
2026-04-24T20:38:48.695Z,2026-04-24T20:38:49.856Z,ill be live just after 10pm bst with iron ram just consooming some chimken tendies 3,dkouhaivt.vtubers.racing,DirtyKouhai ❄️🐱,did:plc:tykrjyt4xbpm5r2i76plnnsg,2,0,0,at://did:plc:tykrjyt4xbpm5r2i76plnnsg/app.bsky.feed.post/3mkbf2cizbk2h,bafyreiaaismjjklnzpktrdhakjuuh2vq5p4sw7syifmoijw4b6sg25yy3e,0.590856671333313,"['derivatives', 'forex']","[0.590856671333313, 0.5489975810050964]"
2026-04-24T20:12:32.688Z,2026-04-24T20:12:39.961Z,when the waiter tells you they re out of chicken tendies,harmfulplant.bsky.social,Frobozz Magic Post Company,did:plc:azsj3fxxjkvndgygwz6uayab,6,0,0,at://did:plc:azsj3fxxjkvndgygwz6uayab/app.bsky.feed.post/3mkbdldjgok2s,bafyreigzam5y6mi4366h4r3b7kxbi5dpnczfnyqhyzym273d3umhhbumpy,0.52372145652771,"['macro', 'derivatives']","[0.52372145652771, 0.5171728730201721]"
2026-04-24T16:44:40.424Z,2026-04-24T16:44:40.361Z,what about nuggies theyre like tendies but cut up,xephersicarius.bsky.social,Xepher Sicarius,did:plc:qpgpv43datjbvl54gmwwtotj,0,0,0,at://did:plc:qpgpv43datjbvl54gmwwtotj/app.bsky.feed.post/3mkaxxmzsms2q,bafyreib6sdv6fmwvl5meaekjsop3o7heo2uhl7ljrjfubdp3rjtbrvnuxy,0.5333266854286194,"['macro', 'derivatives']","[0.5333266854286194, 0.51316237449646]"
2026-04-24T16:43:41.128Z,2026-04-24T16:43:41.256Z,wehhh want tendies but they are too expensive to be worth it now unless you make em yourself,royalpoodle.bsky.social,Royal Poodle > FWA,did:plc:k7uudh4hr3adyhlx64vfgflb,11,3,2,at://did:plc:k7uudh4hr3adyhlx64vfgflb/app.bsky.feed.post/3mkaxvuibe22k,bafyreicul7vmo2ni7yozccot23nccqrtk5iuboatc4lw3xkuxrty52hwmy,0.5698783993721008,"['derivatives', 'forex']","[0.5698783993721008, 0.5543138980865479]"
2026-04-24T16:07:10.727Z,2026-04-24T16:07:11.555Z,they took a massive swig of the magic grape flavor aid that is rugged individualism and thus they refuse to adapt to reality or bathe or eat anything that isnt tendies slathered in melted velveeta or local equivalent they arent all american of course,kerthulhu75.bsky.social,Ray Aune,did:plc:mhfr7zbb7tdrc7xu7qckgkgt,2,0,0,at://did:plc:mhfr7zbb7tdrc7xu7qckgkgt/app.bsky.feed.post/3mkavulkjus26,bafyreidgyc62d4fxdhmawvi2bbhtlgkrkcylvaix5wbfjywqdktgldhlim,0.538707435131073,"['derivatives', 'equities']","[0.538707435131073, 0.4827064871788025]"
2026-04-24T16:02:12.515Z,2026-04-24T16:02:12.958Z,tendies and eggs,icculus.bsky.social,curt.,did:plc:dmupz3q6qwflvpe72vdiiq57,1,0,1,at://did:plc:dmupz3q6qwflvpe72vdiiq57/app.bsky.feed.post/3mkavlp5sak2b,bafyreibbi5oxgp3cybekvtj2bxdzi3vgkvkc3hllxxhkorpsftrznhgzqa,0.5304296016693115,"['macro', 'crypto']","[0.5304296016693115, 0.5252094268798828]"
2026-04-24T02:50:05.782Z,2026-04-24T02:50:06.959Z,shut the hell up daves hot chicken has cauliflower tendies,scientistnathan.bsky.social,Nathan and 99 others,did:plc:htw4iaeofjq3pyx72txceiyz,23,0,3,at://did:plc:htw4iaeofjq3pyx72txceiyz/app.bsky.feed.post/3mk7jdc4z2c2x,bafyreied663jldtkes7wiyqhcp7aafamt3t6oz4gsuqdhd2w255w36b3aa,0.510270893573761,"['derivatives', 'macro']","[0.510270893573761, 0.5022362470626831]"
2026-04-24T00:22:41.353Z,2026-04-24T00:22:41.857Z,im making chicken tendies,mythical.pizza,Bug Friend,did:plc:7wcoiykfzr5zhqk2nmzg2axg,1,0,0,at://did:plc:7wcoiykfzr5zhqk2nmzg2axg/app.bsky.feed.post/3mk7b3pgidc2q,bafyreieh7ogzvdm4ymy2yhl75hiodwfbbatxovlw3k2ppusch2ldtm4x7u,0.545533299446106,"['derivatives', 'forex']","[0.545533299446106, 0.5303388237953186]"
2026-04-23T23:44:44.793Z,2026-04-23T23:44:50.561Z,eating from the earth in starved rock country,erolfpleiss.bsky.social,ERolf,did:plc:kybgtoy24sfub6qb572s67v5,0,0,0,at://did:plc:kybgtoy24sfub6qb572s67v5/app.bsky.feed.post/3mk76xudh5s2e,bafyreiam2dt4jyttdggli7l4xzuxfccbquuvgf2ru5hg6kl52m3mdxmonq,0.5280808806419373,"['macro', 'crypto']","[0.5280808806419373, 0.5150599479675293]"
2026-04-23T22:06:29.746Z,2026-04-23T22:06:30.057Z,tendies,thewayto.bsky.social,j.,did:plc:apdchcxi2otmnsij7dmcfk5x,1,0,0,at://did:plc:apdchcxi2otmnsij7dmcfk5x/app.bsky.feed.post/3mk6zi6esfc2o,bafyreibrfn7vulpmek23rb3matthlaoihvrmsyowmr3lyihynlhtjonil4,0.5368664860725403,"['derivatives', 'macro']","[0.5368664860725403, 0.5256108641624451]"
2026-04-23T21:31:54.853Z,2026-04-23T21:31:55.555Z,the problem with people who want me to be their mommy is that it seems to be equal chances that they mean it in a sexy domme way or a bring me tendies way i have no interest in the former and my willingness to do the latter has been taken advantage of in the past,itszoeallison.bsky.social,Zoe Parker,did:plc:qz6ldmgkkornrdczkhli4o63,2,0,0,at://did:plc:qz6ldmgkkornrdczkhli4o63/app.bsky.feed.post/3mk6xkdm4oc2h,bafyreigsqontjozwabimfaekmuoeaody3rdfpds4mvykyez22obdb4bebe,0.524145781993866,"['derivatives', 'crypto']","[0.524145781993866, 0.5115692615509033]"
2026-04-22T21:59:53.675Z,2026-04-22T21:59:56.756Z,10 for a 10 tendy sharer box at popeye s chicken 3 yeah i m i m certainly going to share these tendies and not eat them all myself,skunkplush.bsky.social,Skunkplush,did:plc:neta6rqcsbjbrc7at2dbtc5n,0,0,0,at://did:plc:neta6rqcsbjbrc7at2dbtc5n/app.bsky.feed.post/3mk4inh74622r,bafyreiewqwum5vpy7rezj7x4pyvelkrgg4glmhcu4hoshpkisokzzrp7ee,0.5722668170928955,"['forex', 'crypto']","[0.5722668170928955, 0.5378817319869995]"
2026-04-21T19:52:40.922Z,2026-04-21T19:52:41.255Z,the jack daniels glazed tendies,jmothemermaid.bsky.social,💅🏻The Wrestling Mermaid🧜‍♀️,did:plc:4hstdgpycgzpa46isyoguxlw,1,0,0,at://did:plc:4hstdgpycgzpa46isyoguxlw/app.bsky.feed.post/3mjzr32kzxc25,bafyreifstf4s6jfgcyaowczw27etsv2abrltghlylisx5gnkq7hqlrpody,0.547393798828125,"['derivatives', 'macro']","[0.547393798828125, 0.5292808413505554]"
2026-04-21T17:37:41.005Z,2026-04-21T17:37:41.359Z,i would be done with the stupid frozen tendies if it wasnt for galactic grill calling theirs the tenderverse how stupid is that apparently they fired the guy who came up with the nearby brilliant pretzel cart name astro knots and hired some jackass who came up with that pathetic,darrenandpoley.bsky.social,Darren and Poley,did:plc:3yicuuabvzxqf3pydqubzo7f,6,0,1,at://did:plc:3yicuuabvzxqf3pydqubzo7f/app.bsky.feed.post/3mjzjjnv7qc2u,bafyreicpworzl7opw6ew3rrijqvt2e3sz2w7zh6nrnotwvi3xgeftsu7de,0.5954297780990601,"['derivatives', 'macro']","[0.5954297780990601, 0.5069549083709717]"
2026-04-21T14:33:36.757Z,2026-04-21T14:33:37.961Z,song parody idea inceltutionalized by suicidal tendies,lexidarlingxoxo.bsky.social,Alexandria W. Darling,did:plc:c2ocjy6iuw2rjo3kqph7mu4a,4,0,1,at://did:plc:c2ocjy6iuw2rjo3kqph7mu4a/app.bsky.feed.post/3mjz7ajbid22p,bafyreidaxybpzfqcmcnyszfszb7vgondg5xy47nbalx5gmueymhihykfea,0.5320746898651123,"['macro', 'derivatives']","[0.5320746898651123, 0.5113452672958374]"
2026-04-21T11:33:18.364Z,2026-04-21T11:33:19.158Z,tendies,hudsonrivercroc.bsky.social,HudsonRiverCroc,did:plc:je6iw2v6se2yp3bituaeglgq,3,0,1,at://did:plc:je6iw2v6se2yp3bituaeglgq/app.bsky.feed.post/3mjyv642dfs2p,bafyreicv6wqeygpn66ijidxfipczw46zwhkamqw62dzomlrvks56vjjhcq,0.5368664860725403,"['derivatives', 'macro']","[0.5368664860725403, 0.5256108641624451]"
2026-04-21T02:42:49.393Z,2026-04-21T02:42:49.959Z,i maintain that the little cup with a hole for your drink straw to go through and then your tendiesfries are like a little snack crown on your bev is basically a god tier innovation,ellieboren.bsky.social,"Ellie, 2.0",did:plc:3gxtuvr44hdsu2ce7k2m6eop,1,0,0,at://did:plc:3gxtuvr44hdsu2ce7k2m6eop/app.bsky.feed.post/3mjxxjjl7w22w,bafyreidqmew2ygvuzth3uk37cye5vh76hj6zyd3jgr33wrbtbrf4stfhxm,0.5127025246620178,"['equities', 'macro']","[0.5127025246620178, 0.5033645033836365]"
