created_at,indexed_at,text,author_handle,author_display_name,author_did,like_count,repost_count,reply_count,uri,cid,financial_score,top_topics,top_scores
2026-04-20T21:57:48.896Z,2026-04-20T21:56:52.964Z,at least youre not shaming me for dipping tendies in my brownie blizzard anymore glad you think so creature 3,berrysnep.bsky.social,Half Slut-Full Whore Consequences🔞,did:plc:a3kjvu437z6le44fpm3ei2kq,1,0,1,at://did:plc:a3kjvu437z6le44fpm3ei2kq/app.bsky.feed.post/3mjxhlvbhss2k,bafyreifmmklxgjmzf47kgfr7wcb62wm72yrpkonq3xnmjvhvualmaltlrm,0.528326690196991,"['crypto', 'macro']","[0.528326690196991, 0.523345947265625]"
2026-04-20T19:18:10.964Z,2026-04-20T19:18:13.159Z,this monday is a better day cause i m have chicken tendies and fries for lunch,culi5.bsky.social,Culi™️,did:plc:lc3wezw5ul4lo7zwpmb5wfei,2,0,0,at://did:plc:lc3wezw5ul4lo7zwpmb5wfei/app.bsky.feed.post/3mjx6oh26ls2f,bafyreiabwalzatrq56uzaaprk2l2kfoz6g5j3kjucdniw4aqhck57b2hfm,0.5385395884513855,"['derivatives', 'macro']","[0.5385395884513855, 0.5327581167221069]"
2026-04-20T18:10:09.664Z,2026-04-20T18:10:10.458Z,is it chimken tendies,kitavy.bsky.social,Kita ≽^•⩊•^≼,did:plc:dzkopkqutbkict7hm7nrjidg,1,0,1,at://did:plc:dzkopkqutbkict7hm7nrjidg/app.bsky.feed.post/3mjx2usss2s2y,bafyreidy5q4i6u3lkwv4wutdqyltds3szex45sa7eybzxpvzbuujvyprg4,0.5488848090171814,"['derivatives', 'crypto']","[0.5488848090171814, 0.5328502655029297]"
2026-04-20T13:17:56.586Z,2026-04-20T13:17:57.056Z,littles get chicken nuggies middles get chicken tendies this is the way,fluffynate.bsky.social,Nate🇨🇦🇺🇸,did:plc:77dd2aggvl5ni5o76gzumnr5,29,5,4,at://did:plc:77dd2aggvl5ni5o76gzumnr5/app.bsky.feed.post/3mjwkkbxplc2s,bafyreiazjsryfopyk7yuhrz5dg4as62e5gqwefn3zq76u2c72uzfa236rm,0.5227750539779663,"['macro', 'derivatives']","[0.5227750539779663, 0.515764594078064]"
2026-04-20T03:24:40.578Z,2026-04-20T03:28:01.659Z,3 different coworkers i dont eat that rabbit food a salad me colon cancer is killing our generation in increasing numbers also you like diarrhea that fucking much what is wrong with you there is more to life than chicken tendies you rubes,nicopell.bsky.social,Nico!,did:plc:a4n3w2het5tahkadz4yzmvak,1,0,0,at://did:plc:a4n3w2het5tahkadz4yzmvak/app.bsky.feed.post/3mjvjfgxryk2l,bafyreigle5n5da4tciku6z4vv6tfszs45wp555pbjuz3tdrbcv5wnv2gem,0.5110556483268738,"['macro', 'derivatives']","[0.5110556483268738, 0.5070218443870544]"
2026-04-19T22:00:58.033Z,2026-04-19T22:00:58.157Z,dont worry my bf is the same way he loves his tendies,spicysnugz.bsky.social,Uncle Rodney 🐊🇵🇷,did:plc:tjqaxaq2kfkmw3bhbbydp5hp,1,0,0,at://did:plc:tjqaxaq2kfkmw3bhbbydp5hp/app.bsky.feed.post/3mjuxcm6qvc2s,bafyreifcknkjxuz4ulr64my3noq2hw4nk3hhu2yabwb7ljqo6ts77dqwti,0.5645411610603333,"['derivatives', 'forex']","[0.5645411610603333, 0.5299766063690186]"
2026-04-19T19:53:06.737Z,2026-04-19T19:53:07.056Z,stalker who spend all day on bluesky harassing people it s about lunch time shouldn t mommy be down with tendies by now you sound hangry,daturabombs333.bsky.social,lumpenpoledancer,did:plc:34u73nofjtiotzvpcs77rrka,0,0,0,at://did:plc:34u73nofjtiotzvpcs77rrka/app.bsky.feed.post/3mjuq5ybdw227,bafyreidhnuzbjzncphk66lrhln3h62qrdcitan2btc2ig4gpavjiwk5mly,0.5209711790084839,"['macro', 'derivatives']","[0.5209711790084839, 0.5111674070358276]"
2026-04-19T19:14:42.696Z,2026-04-19T19:14:43.062Z,cheap crunchy tendies can be kicked up a notch with a quick homemade asian sauce,dustythecritic.bsky.social,Humanist Son of a Preacher Man,did:plc:dusjpfunfuelhl4puetwuw4t,1,0,0,at://did:plc:dusjpfunfuelhl4puetwuw4t/app.bsky.feed.post/3mjunzcxlus2e,bafyreigzw2egsly3eafvgu2sljm7ogbfnjcwtqpomzs4dpmcoyxmdcdjau,0.5858829021453857,"['derivatives', 'macro']","[0.5858829021453857, 0.5441421270370483]"
2026-04-19T18:32:30.122Z,2026-04-19T18:32:30.662Z,do kids taste like chicken tendies hope you brought enough buffalo sauce,coxy77.bsky.social,Nicola Kaye,did:plc:h73jgzvnvv2lgumlfq4gnqi4,2,0,1,at://did:plc:h73jgzvnvv2lgumlfq4gnqi4/app.bsky.feed.post/3mjulntpm2k2s,bafyreibbjdacmyo4ocdpgdoemr4wpftie6nrgkft3oo3zhsjj6s7hkr37u,0.5773158669471741,"['derivatives', 'macro']","[0.5773158669471741, 0.5298753976821899]"
2026-04-19T13:04:58.030Z,2026-04-19T13:04:59.255Z,i love that they added those big tendies to that hairstyle just for him the shape really gave me the impression of a mullet,bellethorns.bsky.social,Seph! 🌌☄ Theron's (and Umbric's) treasure,did:plc:zjpgmfkvug27pdtgxl7npnm3,2,0,1,at://did:plc:zjpgmfkvug27pdtgxl7npnm3/app.bsky.feed.post/3mjtze5zcyc2b,bafyreialiwkbewvya2bermnvtbfgdpw7erncoiuwntc3y3e5irccesdp64,0.5487935543060303,"['portfolio', 'equities']","[0.5487935543060303, 0.5236246585845947]"
2026-04-19T03:57:24.976Z,2026-04-19T03:57:32.556Z,defence pose these are my chicken tendies unless you ask nicely,bytetupoino.bsky.social,Byte Tupoino,did:plc:znfg4gkd2dnmlidwpzubkdh3,8,1,1,at://did:plc:znfg4gkd2dnmlidwpzubkdh3/app.bsky.feed.post/3mjt2r2vrek2o,bafyreidjwpibvqn5fkra7sxovl53pl52fwy7tneo6ydtpku6jqs3nbfhbu,0.5485101938247681,"['derivatives', 'equities']","[0.5485101938247681, 0.525273323059082]"
2026-04-19T03:48:53.276Z,2026-04-19T03:48:56.156Z,bad frozen tendies good not those frozen tendies bad a breadcrumb coating good i have a soft spot for these from back when i worked at knotts and would chow down on these with some gravy on my breaks thin strips but i could eat a dozen of these and not blink appreciate the tots,darrenandpoley.bsky.social,Darren and Poley,did:plc:3yicuuabvzxqf3pydqubzo7f,2,0,1,at://did:plc:3yicuuabvzxqf3pydqubzo7f/app.bsky.feed.post/3mjt2bsvtfs23,bafyreihynr4qanmdirdlman7hrwcscr7yjemsjaeolgd2c772xkblo4oeu,0.5484587550163269,"['macro', 'derivatives']","[0.5484587550163269, 0.5375677943229675]"
2026-04-19T03:08:57.231Z,2026-04-19T03:09:05.156Z,im still scandalized that i found a food truck called chicken with bones and their signature item is a sandwich with tendies,soynielos.bsky.social,l.o.l. bean,did:plc:l63wj6srylm2jete2m62tr24,0,0,0,at://did:plc:l63wj6srylm2jete2m62tr24/app.bsky.feed.post/3mjsy2fv7zs2d,bafyreihoqzdccvsihqx6zw2sd7xm6drtqkk2lwggwfb2btvltzsdtr43yu,0.5096837282180786,"['macro', 'derivatives']","[0.5096837282180786, 0.5083355903625488]"
2026-04-19T01:09:00.418Z,2026-04-19T01:09:00.955Z,chicken tendies and when they were returned to the freezer the ben jerrys made return appearance,shanesbrains.bsky.social,Shane's Brains,did:plc:w6jr7dfvk3u6usqueeny7srk,1,0,0,at://did:plc:w6jr7dfvk3u6usqueeny7srk/app.bsky.feed.post/3mjsrdwgzzc2n,bafyreiahvoza3rhmd7mpz5tvo3d6hzzgbp2uncbet6bwa5ijytk2ucawry,0.5398269891738892,"['macro', 'derivatives']","[0.5398269891738892, 0.5371272563934326]"
2026-04-18T21:26:48.452Z,2026-04-18T21:26:48.865Z,u need chicken tendies,yllom.cc,molly ⧉,did:plc:dusolumaanfphmnc5gqtlbmt,1,0,1,at://did:plc:dusolumaanfphmnc5gqtlbmt/app.bsky.feed.post/3mjsewm3qx22m,bafyreihz6tegjm3lztvjwbuwrgsng52mnzphenngctlj354e46fsajdkcy,0.5518869757652283,"['derivatives', 'forex']","[0.5518869757652283, 0.5284007787704468]"
2026-04-18T20:20:04.151Z,2026-04-18T20:20:05.865Z,sounds like someone rustled your tendies,lapsoirium.bsky.social,irium 🖖🏻,did:plc:a3vx65hezsahjmvdlfrtrurs,0,0,0,at://did:plc:a3vx65hezsahjmvdlfrtrurs/app.bsky.feed.post/3mjsb7bc5rk2m,bafyreidihd3lwpwf7cgkbtigbanx77kv5enhqfbb4oo7leyt7ulpcrtq3y,0.521876871585846,"['macro', 'forex']","[0.521876871585846, 0.5183739066123962]"
2026-04-18T19:07:27.381Z,2026-04-18T19:07:27.760Z,tendies are amazing,domsalvia.iacon.co.uk,Dom but Chopper,did:plc:t3ytnked6jvggqhxwu7hmmev,1,0,0,at://did:plc:t3ytnked6jvggqhxwu7hmmev/app.bsky.feed.post/3mjs55ge4kc2q,bafyreigmxq7jxg7swvqc5gmoe7qliey5gewh4htao7rho7n5vsfj7f7jme,0.5377947688102722,"['derivatives', 'macro']","[0.5377947688102722, 0.5146759748458862]"
2026-04-18T19:06:14.668Z,2026-04-18T19:06:14.156Z,ohoho tfnation crew looks like theres a new nashville chicken place there now time to eat a potentially lifethreatening number of wings and tendies i guess,templephoenix.bsky.social,Temple Phoenix,did:plc:aab75nwnyxnklcptwwbey7yo,16,0,3,at://did:plc:aab75nwnyxnklcptwwbey7yo/app.bsky.feed.post/3mjs53az5pk2t,bafyreif2iaeqkqyc6j3d2pycmjqllrx6zurmasz2umolpxse3brlhkidou,0.5369235873222351,"['derivatives', 'macro']","[0.5369235873222351, 0.5080034136772156]"
2026-04-18T14:56:31.710Z,2026-04-18T14:56:32.057Z,if his young male listeners all start getting laid off while their chicken tendies triple in price aw what am i saying cultists do not leave the cult on their own,davelf.bsky.social,Dave LaFontaine,did:plc:u3opjhw6dbc3jpcw7tqxm64h,57,0,0,at://did:plc:u3opjhw6dbc3jpcw7tqxm64h/app.bsky.feed.post/3mjrp4q5itk2o,bafyreifiaofiuvvzfrg6tm4trgpyu5fls5hj3etnyzgvvmr6ndlwk34qee,0.5545518398284912,"['derivatives', 'crypto']","[0.5545518398284912, 0.5455718040466309]"
2026-04-18T12:08:36.408Z,2026-04-18T12:08:36.856Z,always be nice to your local food vendors the lady in our local chicken place always puts down fresh tendies for me 3,hachune.bsky.social,sonia,did:plc:vr5355jn3nto72upkant4ksu,0,0,0,at://did:plc:vr5355jn3nto72upkant4ksu/app.bsky.feed.post/3mjrfqhlnqs2j,bafyreiemyjaqyhx7ynr5g426e7j35ic7bufahlbxvzjki5vrmpqfibqrya,0.531242847442627,"['forex', 'derivatives']","[0.531242847442627, 0.5310337543487549]"
2026-04-18T11:20:05.504Z,2026-04-18T11:20:09.555Z,tendies nuts,alice22222.bsky.social,Ms. Alice Cumgutter 🏳️‍⚧️,did:plc:42ea5wkdjokmz6sosj5ddvhg,1,0,1,at://did:plc:42ea5wkdjokmz6sosj5ddvhg/app.bsky.feed.post/3mjrczpjzxs2f,bafyreidh4bqbesddszkd2zohdnmtcyr55dtj6pemlxbuov2ezfzdg6yooe,0.5350894331932068,"['derivatives', 'macro']","[0.5350894331932068, 0.5274405479431152]"
2026-04-18T11:01:28.971Z,2026-04-18T11:01:29.660Z,she got back to her order of chicken tendies,clarehg.bsky.social,Clare,did:plc:33wzy5wode5ymil5nnlwjkge,2,0,1,at://did:plc:33wzy5wode5ymil5nnlwjkge/app.bsky.feed.post/3mjrbygpzsk25,bafyreicrh53eksby5zuhzz2wlfzitjuotixtuw3prvryfi7uzhjox3b3dm,0.5436162948608398,"['derivatives', 'forex']","[0.5436162948608398, 0.4981963038444519]"
2026-04-18T08:33:39.854Z,2026-04-18T08:33:41.656Z,taking my tendies is a crime punishable by having ones fingers eaten as substitute c,dusklightdemon.bsky.social,That Gaudy Fox,did:plc:sd3dtfwpwdfqmtltlsu6a235,0,0,1,at://did:plc:sd3dtfwpwdfqmtltlsu6a235/app.bsky.feed.post/3mjqzq4i2qc2v,bafyreihnovoecdazhwb3u7pff4q2u65xxeg2r7eifjouya76lkhhkmtwtu,0.5370781421661377,"['forex', 'derivatives']","[0.5370781421661377, 0.5229932069778442]"
2026-04-18T08:20:58.70545100Z,2026-04-18T08:21:05.970Z,tendies is the weirdest insult and it feels lowkey turkophobic tbh,horsedisc.bsky.social,disc horse bot,did:plc:oke2hwfme37jtbyvtg3upcst,5,1,0,at://did:plc:oke2hwfme37jtbyvtg3upcst/app.bsky.feed.post/3mjqyzlnehz26,bafyreifj2xdceeej4jpbiodctlrmkazn3yt26e7jhtpdls4nbhggwpl77m,0.5339758992195129,"['derivatives', 'forex']","[0.5339758992195129, 0.5209330320358276]"
2026-04-18T08:17:31.663Z,2026-04-18T08:17:31.958Z,did you know you can just take a twinks chicken tendies,donryu.bsky.social,Donryu,did:plc:uvg2wgp4kuydmlxwlrvy3jlq,48,7,15,at://did:plc:uvg2wgp4kuydmlxwlrvy3jlq/app.bsky.feed.post/3mjqytb57pk2n,bafyreighxsodmgn7llt4pwqhlwjcehfpmskufeiv65vcymvrxoytbqfgse,0.5551947355270386,"['derivatives', 'forex']","[0.5551947355270386, 0.5366118550300598]"
2026-04-18T06:24:54.171Z,2026-04-18T06:24:56.455Z,when you find the tip of a finger in your chicken cutlets thank trump he just wants to eat tendies and bacon he doesnt care if you grandma throws out her back in the process youtubecomshortstciwo,jamesowencaffrey.bsky.social,James Caffrey,did:plc:vuvawywsrtr632ucmbqjru45,0,0,0,at://did:plc:vuvawywsrtr632ucmbqjru45/app.bsky.feed.post/3mjqsjuowgk2v,bafyreieqmhtaranrh3vsxujwffftkmz4rra66akvpakf3m46eglsem4bo4,0.545426070690155,"['macro', 'derivatives']","[0.545426070690155, 0.5278251767158508]"
2026-04-18T04:57:24.679Z,2026-04-18T04:57:25.155Z,jollibee is good i liked to get the tendies rice bowl when i lived near one i miss having one nearby also i totally travelled like an hour to get gongcha for that ffxiv collab and the store didnt even get any keychains,unaspi.bsky.social,unaspi 🌌,did:plc:ie5avn76oe43lsvokl523ydd,1,0,0,at://did:plc:ie5avn76oe43lsvokl523ydd/app.bsky.feed.post/3mjqnngf5fk24,bafyreiascw4orlhjr72cib52tyiqjxswi5tyr3jp4ajpmosf3sbxw5y7oi,0.5551218390464783,"['derivatives', 'crypto']","[0.5551218390464783, 0.5263553261756897]"
2026-04-18T00:22:23.112Z,2026-04-18T00:22:27.356Z,come over we re grilling tendies,joshweathersby.bsky.social,josh,did:plc:q76ffcbvwhi2tnfdqvi24pww,10,0,1,at://did:plc:q76ffcbvwhi2tnfdqvi24pww/app.bsky.feed.post/3mjq6bnbdtc2e,bafyreiaohjkivdiaig7r6ajbxlregcxcta56rlc43xxkz3is6bmykissqi,0.5258020162582397,"['derivatives', 'macro']","[0.5258020162582397, 0.48828408122062683]"
2026-04-17T22:37:44.591Z,2026-04-17T22:37:43.058Z,halal tendies and fries because i am a puppy of discernment and class also chocolate cake 3,knautwuff.bsky.social,Knautical Wolf,did:plc:vmyccqwh3yu2jrymggrkys5t,7,0,0,at://did:plc:vmyccqwh3yu2jrymggrkys5t/app.bsky.feed.post/3mjpygjlzpk2o,bafyreidxxac7ibgz2cpwsubgz6zvizjlrq7jhqajamjws7uxuxe44ektda,0.5701727867126465,"['crypto', 'forex']","[0.5701727867126465, 0.5240948796272278]"
2026-04-17T18:34:04.565Z,2026-04-17T18:34:20.259Z,i eat mcds once every 23 years usually when im travelling or its the only thing open but i was already craving tendies before getting slammed in the face with flying nugs n fries so i had to do it now you see it now you dont,momentsinthehotbox.bsky.social,,did:plc:jrvw3lwbsozamq57nrdfxjq3,1,0,0,at://did:plc:jrvw3lwbsozamq57nrdfxjq3/app.bsky.feed.post/3mjpkssudis2v,bafyreifds5hwed4qkoiemcrfckfqjbs5vuu5nm4hxw5azp5vhehewm4qim,0.5580540895462036,"['derivatives', 'macro']","[0.5580540895462036, 0.5388436913490295]"
2026-04-17T17:32:15.721Z,2026-04-17T17:32:16.258Z,chicken littles arguably best plate of basic betch food i have found in a restaurant hand breaded tendies a pile so big i defy someone to show me they ate every last bit in one sitting then either shitload of fries or fries 12 corn cob either is fine delicious fuknow i want that,guyforgetghost.bsky.social,Atleast I’m Enjoying The Ride,did:plc:edxrnz3bvgridahqhai3gifz,0,0,0,at://did:plc:edxrnz3bvgridahqhai3gifz/app.bsky.feed.post/3mjphebtcm226,bafyreih5babeo3lwfbq2qcnuhgkpaj2bmpvx5jzbawg4ipcl5wtfc3iyv4,0.5428268909454346,"['equities', 'macro']","[0.5428268909454346, 0.5204201340675354]"
2026-04-17T17:16:56.585Z,2026-04-17T17:16:57.262Z,best fast food chicken tendies in the game,quidabknowin.blacksky.app,😽 Stanley T'Cucci  😽,did:plc:65rdkiuzp7ud5xtnat7bpmpa,0,0,1,at://did:plc:65rdkiuzp7ud5xtnat7bpmpa/app.bsky.feed.post/3mjpgivbiu22f,bafyreif2e67tklkgkcqzdruezcct2q6fagwstubslrmaxo5tase7x5bqsa,0.5583859086036682,"['equities', 'derivatives']","[0.5583859086036682, 0.5445613265037537]"
2026-04-17T16:47:12.454Z,2026-04-17T16:47:12.658Z,lol ill still just walk up the street and order from the folks behind the counter its never that busy and they always give me extra chicken tendies and flamethrower sauce when i order direct rather than use their app or tie up the drive thru,karlrolson.com,Karl Olson 🌸 Ultraklystron,did:plc:5k6vvdogljoh3ughyhef5b6z,6,0,3,at://did:plc:5k6vvdogljoh3ughyhef5b6z/app.bsky.feed.post/3mjpetps6fk2n,bafyreihxejlx7to6uior5f762ewjwjr37ucue3i3c355krbzf2rohsdr3i,0.5365833640098572,"['derivatives', 'forex']","[0.5365833640098572, 0.5088472962379456]"
2026-04-17T14:14:15.617Z,2026-04-17T14:14:25.555Z,smuttysquid abby angy u stole her chicken tendies and you will know retribution,smuttysquid.bsky.social,🔞Abby Smuttysquid ACAB BLM 🍉[COMMS OPEN],did:plc:gvleiz3wurdo4blbjrnebqyt,44,8,4,at://did:plc:gvleiz3wurdo4blbjrnebqyt/app.bsky.feed.post/3mjp4ca3fhs2x,bafyreiae2ogp7cymkbq7nl3tmhgkuuzhegjutefwhsjo723q3i4xxezf6q,0.5283775925636292,"['derivatives', 'equities']","[0.5283775925636292, 0.5091362595558167]"
2026-04-17T13:04:40.708Z,2026-04-17T13:04:41.059Z,sorry boss not gonna get any work done today i ll be scouring the gram for phish sphere videos anyways gotta get back to watching this hot dog rocket ship fly through some tendies in deep space,embracethebald.bsky.social,EmbraceTheBald,did:plc:o2mu2clitoz4ikewzqho34s7,4,0,0,at://did:plc:o2mu2clitoz4ikewzqho34s7/app.bsky.feed.post/3mjoyfsl7x22u,bafyreifagexmmmgzx53i6jqik2rkwfnx5jp5utxw4beuuxhv4pfs4u5wjy,0.5433211326599121,"['derivatives', 'crypto']","[0.5433211326599121, 0.5413615107536316]"
2026-04-17T06:45:28.91287600Z,2026-04-17T06:45:31.957Z,tendies are fucking disgusting and wont exist under ecofascism,horsedisc.bsky.social,disc horse bot,did:plc:oke2hwfme37jtbyvtg3upcst,49,8,2,at://did:plc:oke2hwfme37jtbyvtg3upcst/app.bsky.feed.post/3mjod7tjwqx2f,bafyreiee5ft76cujuflsazegqvbufbkzlcxokd36bg5azgekdgeqpv33nq,0.560580849647522,"['macro', 'forex']","[0.560580849647522, 0.5402178168296814]"
2026-04-17T04:28:19.792Z,2026-04-17T04:28:20.255Z,love to see young tendies get a shot come end of the season good on him,drakesmitha12.bsky.social,Matt Morhockey-Morbooks,did:plc:fzvwugwhxkw5p3kuumuk2lxg,0,0,0,at://did:plc:fzvwugwhxkw5p3kuumuk2lxg/app.bsky.feed.post/3mjo3kiuo6s2l,bafyreibs2mu7ybrhm22s5x34okv6v4bis7ps4aljza3weso2rvowdjaoga,0.536492645740509,"['macro', 'derivatives']","[0.536492645740509, 0.536470353603363]"
2026-04-17T03:19:32.636Z,2026-04-17T03:19:33.057Z,agreeing comiserating they keep reducing salt in things to avoid the tax on salty junk foods and for some reason instead of just trusting people to condiment it to taste they replace the salt with garlic which is fine except my mum is allergic so many brands of tendies gone,kilieit.bsky.social,Kili🌟🔞,did:plc:avzzu5ivjjlzcd6dr4ta45h7,1,0,0,at://did:plc:avzzu5ivjjlzcd6dr4ta45h7/app.bsky.feed.post/3mjnxpivvf22e,bafyreiaz3s26laa53ksjoknlzwkefkstvy2jv26jzuuz4evayurgatkt3i,0.5490224957466125,"['derivatives', 'forex']","[0.5490224957466125, 0.5352109670639038]"
2026-04-17T02:25:10.139Z,2026-04-17T02:25:10.358Z,gonna make my bestie buy chicken tendies at karaoke so i can eat off his basket,nickpdx.bsky.social,Nick from Portland,did:plc:ppmfyducpoidelje2mberhtt,20,0,1,at://did:plc:ppmfyducpoidelje2mberhtt/app.bsky.feed.post/3mjnuobkf5s2f,bafyreihhaablznhmam6riczcicseqopgac7kjgyvjbmbydb3xgei24ceyq,0.5480536818504333,"['derivatives', 'macro']","[0.5480536818504333, 0.530785858631134]"
2026-04-17T00:21:58.193Z,2026-04-17T00:21:58.761Z,i call them tendies too but when we order them off a menu we just call them whatever is listed most here are called fingers is that normal,alltomato1717.bsky.social,aRealHumanBartender,did:plc:nqxehff4texnsixofinlofxn,0,0,1,at://did:plc:nqxehff4texnsixofinlofxn/app.bsky.feed.post/3mjnnry22w22j,bafyreifvft3qbujucf7ntkmrqw44gg5l4pjsxy6wzcixsprdr7l5zagjqm,0.51548171043396,"['derivatives', 'macro']","[0.51548171043396, 0.5025874376296997]"
2026-04-16T23:15:20.140Z,2026-04-16T23:15:20.357Z,i prefer slight alterations of tenders chicken tendies or chicky tends,aycie.bsky.social,AC 🏳️‍🌈🏴‍☠️,did:plc:oly7pjvfdup62fkhnuo7uegd,1,0,0,at://did:plc:oly7pjvfdup62fkhnuo7uegd/app.bsky.feed.post/3mjnk2t77b22t,bafyreia3uuuth5r3vjqxjvfiluj3wlogtozxwq3bfju4idpno4i2acb7ry,0.5769157409667969,"['derivatives', 'forex']","[0.5769157409667969, 0.5346411466598511]"
2026-04-16T22:03:04.913Z,2026-04-16T22:03:09.156Z,back in america eating airport chicken tendies wishing i was eating a 600 yen karaage bowl from yoshinoya,thenerdtourist.bsky.social,,did:plc:kn43tnbbhgjavuiepptrgrio,1,0,0,at://did:plc:kn43tnbbhgjavuiepptrgrio/app.bsky.feed.post/3mjnfzmsl5c2i,bafyreibbz6hzxn7r4ourlxjsmqwwlpkpjoubnaf6aefdvczv2b5ksaxj4y,0.5744451880455017,"['forex', 'derivatives']","[0.5744451880455017, 0.5506842136383057]"
2026-04-16T20:38:49.602Z,2026-04-16T21:28:14.956Z,my first time at a raising canes they forgot the dipping sauce for my tendies and when i asked for one they looked at me like i was committing a crime it wasn t that good of a sauce yall lol,koumax.bsky.social,Max,did:plc:eo7a2zlkiqagou5kj3snnim3,5,0,1,at://did:plc:eo7a2zlkiqagou5kj3snnim3/app.bsky.feed.post/3mjnbcxopyk2k,bafyreidi7eh7dhbvcyqmou4ttehzam2ajnpbjguo4cty7w3zzjcs7jvy2m,0.5142424702644348,"['derivatives', 'macro']","[0.5142424702644348, 0.4960964322090149]"
