created_at,indexed_at,text,author_handle,author_display_name,author_did,like_count,repost_count,reply_count,uri,cid
2026-04-20T23:07:50.457Z,2026-04-20T23:07:58.356Z,happy lesbian visibility week to some of the characters who helped me figure it out my pirate ladies geni and kallista art by bskysocial my crystal magic girls vivi and kye art by fudgetheroll my scientists aroha and liliflora headlandorgnzissuesissue queerwriters,karamoonauthor.com,Kara Moon 🏴‍☠️💜⚓️,did:plc:ife5lirpm3uuurxwqlzy7xoj,16,7,1,at://did:plc:ife5lirpm3uuurxwqlzy7xoj/app.bsky.feed.post/3mjxlj47zv22c,bafyreifvk4kbm3dl6ut247sxmy4vod7uss3r7t7ztaik6xpdthfq4ljjci
2026-04-20T21:51:19.173Z,2026-04-20T21:51:19.763Z,three issues the two of hearts has a diamond on it he doesn t really even have a seven this ai picture has made him hands too big,heathryan16.bsky.social,Heath Ryan,did:plc:o3tyrck4b52ae5fygjaaksfy,1,0,0,at://did:plc:o3tyrck4b52ae5fygjaaksfy/app.bsky.feed.post/3mjxhabm3wc2m,bafyreih2fcu2yeadjaf3dmscosfuki4vydki6ujiiyo7ta73urc7zej7yi
2026-04-20T20:30:08.388797+00:00,2026-04-20T20:30:08.558Z,kids who play pattern prophet on alpha lab start seeing stock charts instead of just hearing about them one 11yearold went from stocks are boring to predicting price movements in 2 weeks thats not memorization thats real understanding alphalabslearningvercelapputmsourceblueskyu,alpha-lab.bsky.social,Alpha Labs,did:plc:gb26lgrh773643b6qnqzdjlo,0,0,0,at://did:plc:gb26lgrh773643b6qnqzdjlo/app.bsky.feed.post/3mjxcp4ix3o2m,bafyreib744iaa4lifmi3pittl2yzbq667bbqxqv3t6mz7ktzdjd3mwqcg4
2026-04-19T23:49:43.975562+00:00,2026-04-19T23:49:44.857Z,congrats to the diamond hands if you invested 10000 in intel 26 years ago you would have 1022842 today intc,autopilot.extwitter.link,Autopilot,did:plc:swiftpxgixkzdguftbd3l4vr,0,0,0,at://did:plc:swiftpxgixkzdguftbd3l4vr/app.bsky.feed.post/3mjv5f3vmo62o,bafyreiafr3g4p6aac7th3mc7mdmgdhtppba765oph4qpntgngwc4hrsvj4
2026-04-19T19:58:22.513Z,2026-04-19T19:58:29.461Z,another sarah vaughan album i haven t played in a while another great cover that portrait of her has been used a lot in publicity material and on compilations and i have always been insanely jealous of that incredible gown musicsky nowplaying vinyl nowspinning jazzsky,hauntedjukebox.bsky.social,"Haunted Jukebox, with Rockin’ Rachel Roll",did:plc:q6uycf47ozju7tocnrb5zzmh,8,0,1,at://did:plc:q6uycf47ozju7tocnrb5zzmh/app.bsky.feed.post/3mjuqhfgcq22f,bafyreihspcqlhjoxw3sxmehnpziz7xued4rcd3r54pcsqm5fwaghxijtvm
2026-04-19T19:29:48.911Z,2026-04-19T19:29:58.058Z,repostyourart day 19 fruit somehow i havent used fruit in my art in ages had to go waaayyy back to this piece from 2013 the ghost of a friends larp character under an apple tree that was planted in her memory,illustratedjai.bsky.social,Jai (they/them),did:plc:cmmfmywj4es363ixoy6isctd,3,1,0,at://did:plc:cmmfmywj4es363ixoy6isctd/app.bsky.feed.post/3mjuoud75g22u,bafyreia3ma3rm32il6iswzzx5h5pbhbhzuhxbw3pref2v6bv4gsyeder4u
2026-04-19T17:05:39.054Z,2026-04-19T17:05:44.562Z,and i was catching my breath floors of a cabin creaking under my step,sprinklersplashes.swifties.social,💖💛Janis 💛💖,did:plc:34dvmhjjqamrhocp52y6nzx3,21,6,0,at://did:plc:34dvmhjjqamrhocp52y6nzx3/app.bsky.feed.post/3mjugsk2jfc2f,bafyreidnlp4gkfcfzkmvjktyncqwtgiahvmun3bkpuybbvcaotcejgnxde
2026-04-19T16:02:56.715Z,2026-04-19T16:03:02.956Z,the grainy waters takes the constellation deep under the diamond waterfall captains got the hook wedged at the wheel arti with great trickery gives navigation calls arti captain s sinking the deck crew crew crew keep ya hands on ya kecks captain s sinking the deck vss365 m balmer,chrisandprose.bsky.social,Chris Andrews,did:plc:7mkptrccotnnqye43kofx6l5,11,2,0,at://did:plc:7mkptrccotnnqye43kofx6l5/app.bsky.feed.post/3mjudcfzb2c2i,bafyreibppy3pu7ypknq4bufgjrcbcwm27gvwws7fpjgs7kyiuemzbqodmq
2026-04-19T10:25:08.758Z,2026-04-19T10:25:12.460Z,daily wonho,wayneinau.bsky.social,Wayne | Currently Daily #wonho,did:plc:dd7wikzuv7gailrijc3jiux3,9,3,0,at://did:plc:dd7wikzuv7gailrijc3jiux3/app.bsky.feed.post/3mjtqgexyjk23,bafyreiezncmhskwa4dcw2nrtwtbbapray4ihm74xnuo3u3xgldgjposk5e
2026-04-19T06:33:39.580Z,2026-04-19T06:33:40.359Z,the alternative is to chase it like tulips and hope that youre not holding the bag when diamond hands bust a move on you 2,amicusopus.bsky.social,Full Name,did:plc:7v7xowx6plt7ns2wcyeiednd,0,0,0,at://did:plc:7v7xowx6plt7ns2wcyeiednd/app.bsky.feed.post/3mjtdih7v5s2c,bafyreibgwpsjnmvqb6ul2jph4uk3xnbf7vdi3eu2cebq3z5mptfp23w5yy
2026-04-19T00:08:30.558Z,2026-04-19T00:08:34.255Z,poemsabout gravity couk i mentioned to bskysocial that there were a number of planetary entries but no one mentioned the planets by gustav holst dean said i should accept it as s challenge i actually have an elegy i wrote in 2021,johnchmura.bsky.social,John Chmura,did:plc:xdsafbyenhkdiwry6znl7bki,21,1,5,at://did:plc:xdsafbyenhkdiwry6znl7bki/app.bsky.feed.post/3mjsnxqqops2n,bafyreiajojbwusoafezxhlnoyvmbn6szyl6oe2gmnbmrqa3idddpb74ca4
2026-04-18T20:58:59.021Z,2026-04-18T20:58:59.656Z,weak sauce where are your diamond hands,chelseachemist1.bsky.social,,did:plc:ts752z2jg5db35xybf3o3ugb,1,0,1,at://did:plc:ts752z2jg5db35xybf3o3ugb/app.bsky.feed.post/3mjsdetyqb22o,bafyreihaog3e66vfrwrafmb6p75o3yn3xgm76crqhhcf4slq62b7rpfn4e
2026-04-18T20:12:28.526Z,2026-04-18T20:12:33.359Z,xzero week 2026 prompts are finally revealed tumblr post xzeroweek xzeroweek2026 xzero,edoubunny.bsky.social,⭐EdouBunny⭐ | Code: Crimpphire AU Writer!! 💙❤,did:plc:mbcx35zdsweognifwhvu4eiy,2,1,0,at://did:plc:mbcx35zdsweognifwhvu4eiy/app.bsky.feed.post/3mjsarosjr226,bafyreifqxf2v3jtp4j3i6qnrpyz4lepovatekqg2scsyviwztooh2vt3ra
2026-04-18T18:13:01.449Z,2026-04-18T18:13:08.856Z,decompressing after work it feels good,fritzbonn.bsky.social,✨🔞Fritzbonn🔞✨ probably stinks but in a cool dignified way,did:plc:imyuvrbccpzlmo2nsoqkvhgm,1229,252,12,at://did:plc:imyuvrbccpzlmo2nsoqkvhgm/app.bsky.feed.post/3mjs243r3t226,bafyreienawlhjyxjrh4qvk32677dspnb2dzpzkotndhp5m57wvwdkeovz4
2026-04-18T18:02:29.316Z,2026-04-18T18:02:31.156Z,if newtons diamond was a cat ansiart asciiart caturday,labcoatgundam.bsky.social,Retrocrantz and Guildenstream are Dead,did:plc:bsqafgdj6qs5vfhfmafxswaz,2,0,0,at://did:plc:bsqafgdj6qs5vfhfmafxswaz/app.bsky.feed.post/3mjrzjaumh22t,bafyreifnky2fpxqnrflj5yhaiy5dsbb6mhlhr43pkjqrn4n5fpn6nytcje
2026-04-18T15:24:02.949Z,2026-04-18T15:24:07.160Z,the best ever record store day release until i can get my hands on that sonic youth diamond seas disc,grahamreznick.bsky.social,Graham Reznick,did:plc:ks253nbomml43uoapzpmtwja,5,0,0,at://did:plc:ks253nbomml43uoapzpmtwja/app.bsky.feed.post/3mjrqnwveus2g,bafyreig7x5wjkvp6beh2qyasj7gqm4h7kihixaeteya6zv24gtw7ub2ytq
2026-04-18T06:23:52.588Z,2026-04-18T06:23:58.557Z,collab drawing with bskysocial kamashibskysocial and bskysocial art drawing oc sona,scuffed-doodlz.bsky.social,Scuffed-DoodlZ,did:plc:vzwmqmndulqi4kntwshzi6k6,8,1,0,at://did:plc:vzwmqmndulqi4kntwshzi6k6/app.bsky.feed.post/3mjqshzyc7s23,bafyreid6f4mwpzuejhejxbbl27i5e5xt7n4lkfucrtbf6rzkfswvsdrwca
2026-04-18T04:34:20.576Z,2026-04-18T04:34:21.659Z,hmmm curiously she puts her hands on those solid diamond breasts i do have to wonder why these are here does the omnitrix make a hybrid of human and alien,cyntruvidas.bsky.social,ℂ𝕪𝕟𝕥𝕣𝕦 𝕍𝕚𝕕𝕒𝕤,did:plc:v6nr2baos67iue2vcq7wnrxf,1,0,1,at://did:plc:v6nr2baos67iue2vcq7wnrxf/app.bsky.feed.post/3mjqme6fpc22x,bafyreieu5pqysgtj63hijmbis5azl5zsusxbx45d4hlk5unsfocqp7ktpi
2026-04-18T04:29:46.749Z,2026-04-18T04:29:49.454Z,new patches i ll have at bics tmrw industry city in brooklyn also will have very limited stock of these two mask chain designs with custom fitting available hope to see you there,hheistt.bsky.social,hheistt,did:plc:tphyiu2kcnzpkg6u67g7qqy5,43,23,3,at://did:plc:tphyiu2kcnzpkg6u67g7qqy5/app.bsky.feed.post/3mjqm3zb73k2w,bafyreihncirvu5xkf3fipua25iyu6ksfhhgylyxecpr3esgjsgciveknxu
2026-04-18T00:10:10.678Z,2026-04-18T00:10:11.355Z,if anyone wants to do some insider trading i happen to know the good folks at notagriftcom are about to pivot to ai get in now to go to the moon diamond hands etc,jjw.wtf,JJW,did:plc:szwfwpqor22ffwbop2ypqfzg,0,0,0,at://did:plc:szwfwpqor22ffwbop2ypqfzg/app.bsky.feed.post/3mjq5lsr7bk2w,bafyreibmr5zymlt243xvjvyj4m73i4srrbyxusko7sij5vrrm2zlyjj2we
2026-04-17T19:21:59.678Z,2026-04-17T19:22:03.756Z,friday 5x5 musicsky,beef717.bsky.social,beef,did:plc:utsnnxaizdyfwnfphmipjngu,2,0,1,at://did:plc:utsnnxaizdyfwnfphmipjngu/app.bsky.feed.post/3mjpniiryvk2k,bafyreiabizdbq62tiv2disqvngx4nkzxdkcab36j7izvgtroi6ka57mnwm
2026-04-17T12:37:05.506Z,2026-04-17T12:37:19.062Z,the violent jump from 2019 to 2026,lumenheine.bsky.social,Lumen ⚔️,did:plc:4bmkxbxhdbbvmd3djkogcoln,99,9,1,at://did:plc:4bmkxbxhdbbvmd3djkogcoln/app.bsky.feed.post/3mjowui2jp22a,bafyreig37cf443ju7zc3f2lvv4yxhcap6jsozfbu4c3sd7s3ni3lrp45ze
2026-04-17T06:03:22.801014Z,2026-04-17T06:03:23.558Z,good morning from tkws today s financial dictionary term diamond hands,kenyanwallstreet.bsky.social,The Kenyan Wall Street,did:plc:f5l5lghllyq4ywhpeo22u7eo,0,0,0,at://did:plc:f5l5lghllyq4ywhpeo22u7eo/app.bsky.feed.post/3mjoauhvnqg2o,bafyreibygkgzexcsaspz6zdvdyg2f3isxxfwvhe7xom6ouw6zz7ryxhqtm
2026-04-17T02:56:09.226Z,2026-04-17T02:56:13.658Z,got these kos off ebay but idk the maker obvs not real labubus anyone recognize them the qc isnt great theres hands instead of feet on the red one yellows ears r sideways but idk paintjob is great for a ko i like the accessories theyre cute idk sry the pics so blurryy ocsky,oozeandgoo-art.bsky.social,Red | artist |  any pronouns,did:plc:7gtqze274bwy4h2mqix7p7qw,1,1,1,at://did:plc:7gtqze274bwy4h2mqix7p7qw/app.bsky.feed.post/3mjnwfojwbc2e,bafyreibyikicmjyoqfa2i2em5knyxdifwynd3sj7anrenow7j4oe2dq5de
2026-04-16T23:00:08.710568+00:00,2026-04-16T23:00:08.960Z,most investing books tell kids to start early and buy index funds true but boring enough that theyll never actually do it kids need to feel what a bad trade costs before they read about it alphalabslearningvercelapputmsourceblueskyutmmediumagentutmcampaignalphalabutmcontent,alpha-lab.bsky.social,Alpha Labs,did:plc:gb26lgrh773643b6qnqzdjlo,1,0,0,at://did:plc:gb26lgrh773643b6qnqzdjlo/app.bsky.feed.post/3mjnj7nzyvi2k,bafyreid4jzzzwsxv7pstcfpozocyamfirtnmctbttodfjtzme2w5uavw3y
2026-04-16T12:04:38.278Z,2026-04-16T20:58:18.178Z,good morning bluesky happy thursday aka bagel dayyy finally basically the weekend for meee have a half day today in this already 81 office sweating then off to nyc and seeing lewis capaldi at msg and off work tomorrow well let s have a magnificent dazzling day love you mean it,repbecca.swifties.social,𝔯𝔢𝔭𝔟𝔢𝔠𝔠𝔞𓆙⸆⸉,did:plc:q5sjr6burpyencjnkkrgt2le,18,0,1,at://did:plc:q5sjr6burpyencjnkkrgt2le/app.bsky.feed.post/3mjmeljl3u22i,bafyreie4yk3sqdbfz65ejzsjpz3sydo5abacoundpcqa5fnh4tvaputlse
2026-04-15T16:42:17.711Z,2026-04-15T16:42:18.493Z,chief schultz is on 1a right now and he started off strong by getting the usfs motto wrong my buddy summed it up well trust me bro usfs to the moon diamond hands,timberdoodlydoo.bsky.social,Timberdoodle,did:plc:i7kvf5o6cvw4itu4g3sd6roi,5,0,0,at://did:plc:i7kvf5o6cvw4itu4g3sd6roi/app.bsky.feed.post/3mjkdn3rtgs24,bafyreiepdc2jmwyw3qaq7i5suedk53ta5r646fwbywysmi5cqlpfb5t72q
2026-04-15T15:11:02.962Z,2026-04-15T15:11:07.891Z,heres my sticker design of bskysocial and i that ill be passing out at fanfestwoltrade na im so excited see yall soon art ffxiv ffxivfanfest2026,blacksugarpill.bsky.social,Silver 🐈‍⬛️🪱,did:plc:7sse3pwo45do6h3we2eue4mn,67,15,4,at://did:plc:7sse3pwo45do6h3we2eue4mn/app.bsky.feed.post/3mjk6jwoch22l,bafyreicsspr5gj2ygcn4kuyk65xrub6vesrpeq7uuniwhr5o3kfbcwt2i4
2026-04-15T05:23:45.444Z,2026-04-15T05:23:52.195Z,rule number 1 never rub another mans rhubarb gremlock oc puma comics persona,jathanielprince.bsky.social,Jathaniel Prince,did:plc:ho6f2hn6hcscyhi6iop3xw3u,2,0,0,at://did:plc:ho6f2hn6hcscyhi6iop3xw3u/app.bsky.feed.post/3mjj5prk45k2p,bafyreiegynuiehsje75afnyu4joviiohqbgffc43siy3642t2fauzkuf2u
2026-04-15T05:20:10.298Z,2026-04-15T05:20:10.692Z,keep my dolls inside diamond boxes save em til i know im gon drop this front ive built around me oasis paradise is in my hands,whatgagasaid.bsky.social,whatgagasaid 💬,did:plc:oftp4xyhheqb3xhwyt57rfko,0,0,0,at://did:plc:oftp4xyhheqb3xhwyt57rfko/app.bsky.feed.post/3mjj5jejcpp2j,bafyreiaripzorzn4orcpgvmfikpcuol2pijcdkuxo6r5rzroyj32k6j72u
2026-04-14T22:21:52.547Z,2026-04-14T22:22:01.194Z,we need diverse books day was created to highlight the importance of reading books that reflect our beautifully diverse world here are bipoc lgbtqia2s books published in 2026 book lists in alt text 12 weeneeddiversebooks wndbday diversebooks lgbtqbooks bipocbooks 2026publication booksky,lisacowanpineo.bsky.social,Lisa Cowan Pineo,did:plc:rj4ytlv3ecybfl4rnxu26og4,15,2,2,at://did:plc:rj4ytlv3ecybfl4rnxu26og4/app.bsky.feed.post/3mjig5fcklk24,bafyreigv3ashq43x277bzvnygcnnvwfohkhbfgmdqu5mtmtifjtm3xyd54
2026-04-14T21:46:45.180Z,2026-04-14T21:46:45.401Z,hiya portfolioday im smudgy an illustrator and graphic designer that loves character centered work im available for work and would love to collaborate with more people in the near future my website my inprnt my kofi contact smudgyinkartcom,smudgyink.bsky.social,Smudgy @ Residential Evils,did:plc:rqa4mgwr5zzxxefpqq6dveks,10,7,0,at://did:plc:rqa4mgwr5zzxxefpqq6dveks/app.bsky.feed.post/3mjie6lak3n2i,bafyreia66qwwpdo3x44i7nnc3zojhp7hggevgr2ptppzmh7xskdovaj7nu
2026-04-14T20:30:08.429260+00:00,2026-04-14T20:30:08.698Z,your kid asks why should i care about the stock market and you freeze because the honest answer is im not sure how to explain it either alpha lab lets them find out by actually trading real prices real wins real oh thats why that matters moments,alpha-lab.bsky.social,Alpha Labs,did:plc:gb26lgrh773643b6qnqzdjlo,0,0,0,at://did:plc:gb26lgrh773643b6qnqzdjlo/app.bsky.feed.post/3mji7vls5yy2d,bafyreiclilvygjjf7cvipab7is3fky3cbidg7ivtxdsxeqsiipm4kcbnmq
2026-04-14T19:45:43.127Z,2026-04-14T19:45:51.092Z,hot dang its portfolioday im yven i mainly draw hot elves doing hot shit art site galleryyvenelicarrdco commission infoyvenelicarrdcocoms other cool trans enby artistsbskyappstarterpack,yven.bsky.social,YVEN ✨,did:plc:yja5so7bz5ls7usogb4acsjt,7,4,0,at://did:plc:yja5so7bz5ls7usogb4acsjt/app.bsky.feed.post/3mji5g5wkek2z,bafyreig2iksy5kx4a4uygpaznkbtbhng6akrh3sqoydqlu564igmlzebfu
2026-04-14T19:29:21.667Z,2026-04-14T19:29:45.695Z,nerd protective self critical into giving body worship ass and thighs type of guy open to polyamory into feminine vibes regardless of gender rough around the edges built like photo 1 face and hair like photo 2 only date people over 20yo who d want a guy like me,cs626.bsky.social,"Ripcord626⛔️(18+ only)⛔️,⚠️(Minors DNI)⚠️",did:plc:ghxjet52567zon7fhdy6rjnx,0,0,0,at://did:plc:ghxjet52567zon7fhdy6rjnx/app.bsky.feed.post/3mji4ivyjy22o,bafyreifwgq3jzmgzmxgmkrttob7z6oxpvmbxpnhbtwlp6c7yx5uicaodkq
2026-04-14T17:36:55.892Z,2026-04-14T17:37:21.801Z,hello portfolioday im philip rice spearhafoc i write and draw a pulpthemed webcomic called the apex society apexsocietythecomicseriescom in a variety of styles here are some recent paintings i did for it,spearhafoc.bsky.social,En Sabah Neurodivergent ,did:plc:jqoxhyaunsi6nyixtcbzjwgd,13,9,1,at://did:plc:jqoxhyaunsi6nyixtcbzjwgd/app.bsky.feed.post/3mjhw7ungvs25,bafyreifeu642hqu2stkdtkgdkk453v6ndtbcahsuav26wana2oheogw3mu
2026-04-14T15:57:49.403Z,2026-04-14T15:58:07.292Z,hi im notdonyet 2d 3d artist animator selfmade vtuber bskysocial working all year on my own animated short film zip transfer follow along that journey here on bsky myrmidonvtcarrdco sortofdoncom portfolioday portfolioday,notdonyet.bsky.social,NotDonYet,did:plc:m354dv5vkxcsgleyl5eqmvcb,10,7,1,at://did:plc:m354dv5vkxcsgleyl5eqmvcb/app.bsky.feed.post/3mjhqonqd6s2w,bafyreiexi2hp7qnh7hwp7pgvrxj62xynniwfptqou5fojsiyoucomp6f5y
2026-04-14T15:02:57.127Z,2026-04-14T15:03:18.995Z,a little light for you my dutch angel dragon love how the markers and gold ink turned out the original has already found its home art traditionalart dutchangeldragon furryart furryartist markers dragonart,aleksa95.bsky.social,Aleksa the Pirate.,did:plc:tu7l6cxdee744gpnrhbd5oj3,1,0,0,at://did:plc:tu7l6cxdee744gpnrhbd5oj3/app.bsky.feed.post/3mjhnmjurg225,bafyreigvtxrk6fpqascvakjru5mkfta4z3kwnlvvd32pk7nqtd3evec3o4
