created_at,indexed_at,text,author_handle,author_display_name,author_did,like_count,repost_count,reply_count,uri,cid
2026-05-01T18:32:05.351Z,2026-05-01T18:32:05.778Z,def parseargs parser argumentparser return parser these 3 python morsels exercises include examples of parseargs functions in their solution walk throughs,trey.io,Trey Hunner,did:plc:nanrhx7h54a4p72udpmptgop,1,0,1,at://did:plc:nanrhx7h54a4p72udpmptgop/app.bsky.feed.post/3mksra5mnms2z,bafyreigb4gtjpz2kl7wkgfebflryelbbhqyffh32eglqyet6yrixjy7vpe
2026-05-01T18:31:47.288Z,2026-05-01T18:31:47.475Z,hvis rettsvesenet ikke klarer bedre enn dette m vi som samfunn snart nesten ta en alvorlig voksenprat om f i gang et gulag eller to,smaamorsomt.bsky.social,Smaamorsomt,did:plc:5ho7blitusby5qdalujsgxqf,3,1,0,at://did:plc:5ho7blitusby5qdalujsgxqf/app.bsky.feed.post/3mksr7mffy22z,bafyreicy2wqsoqama5pzqlnn5qlkruzevfnpe6ua3fpclvo77a2qt7lic4
2026-05-01T18:31:16.874Z,2026-05-01T18:31:17.976Z,fa il lusi tenir fmab en catal youtubexcsppc963ni,norndis.bsky.social,Skuld 🌸🪷🌷,did:plc:3yp4exubj4p3rpnoac643au6,6,2,2,at://did:plc:3yp4exubj4p3rpnoac643au6/app.bsky.feed.post/3mksr6pfjls26,bafyreicl4lzrfm4dvr347gqgdtau73ck2xe77thxooyxgqokedjcfzruau
2026-05-01T18:31:12.493Z,2026-05-01T18:31:14.378Z,with a comment from fa that makes 4 we gotta keep it going kuramas going to be too shy unless he knows everybody else thinks its a good idea,koalabot.bsky.social,KoalaBot,did:plc:jd3izt6srule7iyzs52rbfej,1,0,0,at://did:plc:jd3izt6srule7iyzs52rbfej/app.bsky.feed.post/3mksr6l7jj22a,bafyreihxv6rclemiavj54mtmd6qs3dezheprnirr46sb4edeallmwuz37y
2026-05-01T18:31:11.363Z,2026-05-01T18:31:11.878Z,visa tuttar r tydligen ett bra s tt f r att f tuttar i fl det,mandreas.bsky.social,Andreas,did:plc:wucczq36fmh2z2pedu3epkdn,1,0,1,at://did:plc:wucczq36fmh2z2pedu3epkdn/app.bsky.feed.post/3mksr6k4zyk2m,bafyreifxe4ddohier3esfxiluee4baua6keeyagubfvg7xgts4ot4abof4
2026-05-01T18:30:53.026Z,2026-05-01T18:30:56.775Z,princess fa mulan mulan 1998 disneyprincesses famulan classicdisney,soujimaotwist1.bsky.social,🪶SOujiMao2🪶,did:plc:5kasko7fnzyhhxnbhqhfomns,0,0,0,at://did:plc:5kasko7fnzyhhxnbhqhfomns/app.bsky.feed.post/3mksr5ynhqk2t,bafyreihlxpivsyk67xasdlayrqh527pq5frwjtvoulxzh76is462szv7wa
2026-05-01T18:30:43.482Z,2026-05-01T18:30:46.710Z,also posted on fa and db derpibooruorgimages3810640,nonuberis.bsky.social,Non Uberis,did:plc:kpsx4gi2s7s5yp5djciwenj4,0,0,0,at://did:plc:kpsx4gi2s7s5yp5djciwenj4/app.bsky.feed.post/3mksr5rrjns2q,bafyreibnbdp5nvuwg724xtfhvgvpyiowz5r4vkw6hl7addhs5nylz3xlc4
2026-05-01T18:30:04.071Z,2026-05-01T18:30:04.772Z,five i saw five speedpaint for zenfox over at fa and their friend fio whos telling a slightly exaggerated story that probably involves some other scenic meadow theyve passed on the way 3 art anthro canine wolf fox furryart picnic mountains,himmis.bsky.social,Himmis,did:plc:bm52betwgvsbccfacl6tvktc,43,11,1,at://did:plc:bm52betwgvsbccfacl6tvktc/app.bsky.feed.post/3mksr4k2abv2c,bafyreicw7qqvo7pxnuh2mxzxa6bczkgqvzgjnudbbi5sndtg6wcrhhpuia
2026-05-01T18:29:39.779Z,2026-05-01T18:29:39.577Z,someone on fa commented well now that is something i can genuinly say i have never seen before im coming up with smut scenarios previously thought unthinkable do you realize how rare it is to catch a furaffinity user by surprise,angusburgers.bsky.social,Dani(They/Them)- Commissions closed until May,did:plc:7tiia5rclvwibxngh7mvrlsw,123,10,7,at://did:plc:7tiia5rclvwibxngh7mvrlsw/app.bsky.feed.post/3mksr3ss5hs2m,bafyreibu5vhhmb6rxl4iielxrj3e3kyk74yzw5mcrg4hxjgpuap576j2n4
2026-05-01T18:29:25.606Z,2026-05-01T18:29:25.977Z,to me the hawks have exactly two things worth talking about jalen johnson who s a good robin for now pelicans lottery pick mccollum is a fa naw is a nice player okongwu is a nice player daniels is ben simmons 20 what else is there they re practically at the start of a rebuild,plootube.bsky.social,God Emperor Doom,did:plc:vx3lmquijgn4b246jeo2opki,0,0,2,at://did:plc:vx3lmquijgn4b246jeo2opki/app.bsky.feed.post/3mksr3fbmnk23,bafyreignywdkvslblfg7eth2qoke3x5x3pmardd3imohyyhb4qe5e3mu5i
2026-05-01T18:29:14.635Z,2026-05-01T18:29:16.879Z,sb by magimutt on fa,diaszoom.bsky.social,🐾Diaszoom 🐾,did:plc:upmx34q37dxha4q2avlrmk4j,0,0,0,at://did:plc:upmx34q37dxha4q2avlrmk4j/app.bsky.feed.post/3mksr32srsk25,bafyreig2bosmkjqcivp5vuopufi7qubevyv2w2lvx2et72wxseepwjusqm
2026-05-01T18:28:25.795507Z,2026-05-01T18:28:26.582Z,efta00466895jpg epsteinweb efta00466895 available in the ios app store now,epsteinweb.bsky.social,Epstein Web,did:plc:ndjyym3ihrqu3g25gdztefrv,0,0,0,at://did:plc:ndjyym3ihrqu3g25gdztefrv/app.bsky.feed.post/3mksqzminp72w,bafyreiaynll3fnve5rauo3hcuiimrdjmsbvy72iw7ffzjy2pv7rsswihuq
2026-05-01T18:27:27.471Z,2026-05-01T18:27:28.578Z,mi fa piacere essere nella cerchia anche se al limite,dede3006.bsky.social,,did:plc:mzuo5cbze43byayobrjtgrpy,1,0,0,at://did:plc:mzuo5cbze43byayobrjtgrpy/app.bsky.feed.post/3mksqxumfhk2r,bafyreib6nnukbidegla5kttm74jz6j7hh4r2f4ykulmfend72eb4dcoija
2026-05-01T18:25:50.761Z,2026-05-01T18:25:54.081Z,non vale niente come tutto quello che fa questo governo,marittima.eurosky.social,Marittima,did:plc:ewhs4cfilpixnktugdqp6um7,1,0,0,at://did:plc:ewhs4cfilpixnktugdqp6um7/app.bsky.feed.post/3mksquyf2422b,bafyreibdbekowyjlmlps3g2gtcspdp7ideotjrajepkkwhjm6yymi2ptm4
2026-05-01T18:25:48.697Z,2026-05-01T18:25:49.274Z,i tend to agree but when a guy wants out you start to lose leverage you d definitely have to give up at least one bell cow plus a lot of potential for them to call it a win but i weirdly feel like we have that that said i don t realistically think it can happen or he comes here as a fa tbh,jkarsh.bsky.social,Jason Karsh,did:plc:4h5i777qrlks2ew6nqtw4qy7,2,0,1,at://did:plc:4h5i777qrlks2ew6nqtw4qy7/app.bsky.feed.post/3mksquwg2i22n,bafyreibvjdqxovbxczbysteyftut2zieunnm6hsetglxicgnfjtgpzuvau
2026-05-01T18:25:12.634Z,2026-05-01T18:25:13.073Z,folk skulle bli f rv nade hur mycket elbil de kan f f r pengarna de nu ist llet l gger p bensin och diesel till utl ndska oljebolag f r att rulla sina fossilskr llen,cs1891.bsky.social,Strömberg,did:plc:shrp6mivec4llbs27c2xwpbq,17,3,5,at://did:plc:shrp6mivec4llbs27c2xwpbq/app.bsky.feed.post/3mksqttzkns2w,bafyreidpbhrzeyhnwqldzirlr373hqnk5gfaklqnrbifvzc6mkqtikqy4q
2026-05-01T18:25:08.711Z,2026-05-01T18:25:09.474Z,uhhhhh how you feel about fa i really love the metheus and metheus kai,zetabuster.bsky.social,Christian,did:plc:nnicbo4ktb7bbvysbeklg632,0,0,0,at://did:plc:nnicbo4ktb7bbvysbeklg632/app.bsky.feed.post/3mksqtqbsms2j,bafyreiedn2zhbvc56h4sw22ugizhcehcyu3jadj35ikl5lwn3qo7oz3acu
2026-05-01T18:25:04.269Z,2026-05-01T18:25:06.377Z,palestinian soccer federation president jibril rajoub refused to stand alongside israel fa vicepresident basim sheikh suliman in a heated moment at the fifa congress on thursday,thejerusalempost.bsky.social,The Jerusalem Post,did:plc:724gpbnyikkk2zsafpdtwgzu,1,0,1,at://did:plc:724gpbnyikkk2zsafpdtwgzu/app.bsky.feed.post/3mksqtnby3q2s,bafyreidfliur3aifqatklwhnv4secxkvtpa6utznme4q5b5r3rcxda7hwe
2026-05-01T18:24:18.000Z,2026-05-01T18:24:27.675Z,det r s sjukt effektivt vi f rs kte inte ens f s mycket gjort det bara h nde,karolina.mastodonsweden.se.ap.brid.gy,Karolina,did:plc:ruxlhlkteummmo3t3kwkniwc,0,0,0,at://did:plc:ruxlhlkteummmo3t3kwkniwc/app.bsky.feed.post/3mksqsctosjm2,bafyreiehk4y65twvq7vv3gne4zh6fcorlsy24gpp355qnnd5jbhjjatocq
2026-05-01T18:24:03.000Z,2026-05-01T18:24:04.373Z,sikke et held for prince jr at medspiller for stoppet ham i at f det andet gule kort i kampen,uffewelander.bsky.social,Uffe Welander,did:plc:jwn3yfhhuwousxlq7v2ykmxm,0,0,0,at://did:plc:jwn3yfhhuwousxlq7v2ykmxm/app.bsky.feed.post/3mksqrrmhq224,bafyreietkt7jul3xdxojrpzfln3lrsxb5svaqfwyiopmj43rwsn6qhqhtm
2026-05-01T18:22:58.470Z,2026-05-01T18:22:57.477Z,engagement is down everywhere but milling around da is like traipsing through a graveyard crawling with those slow tired zombies thats also crumbling into the sea fa would be my next choice if i dabbled more in furry stuff whats itaku like does it lean more tumblr or twitter,hexfloog.bsky.social,🧂Hexfloog🧂,did:plc:thfir2hjkpthqse3c7vmay3j,0,0,0,at://did:plc:thfir2hjkpthqse3c7vmay3j/app.bsky.feed.post/3mksqpu365k2h,bafyreicx46lnvl7nhxwi7fx4vqapd3nnqvla4nbzumk44gfgybj6jjjm4a
2026-05-01T18:22:14.733Z,2026-05-01T18:22:31.696Z,falkland islands sovereignty referendum march 2013 the result was fixed president cristina kirchner of argentina,britbob1.bsky.social,,did:plc:gvvbgyk57kxflwpzpavuqlhm,0,0,0,at://did:plc:gvvbgyk57kxflwpzpavuqlhm/app.bsky.feed.post/3mksqokegac2z,bafyreifsizi5r77g2ax2e4cc2o4hn42wm7i6nfydmpcvqmdhfboj22olgm
2026-05-01T18:22:09.575Z,2026-05-01T18:22:10.473Z,oddio jo genitori mezzo infartati e tu senza pranzo la prossima volta ce lo dici e te lo ricordiamo noi come non si fa ho fatto la stessa cosa anni fa mai pi mia mamma a momenti sviene in giardino,anna0tt0.bsky.social,Anna0tt0 🌵,did:plc:beykkg3vcimk6vpshe5norjf,2,0,1,at://did:plc:beykkg3vcimk6vpshe5norjf/app.bsky.feed.post/3mksqofgz4s2d,bafyreibzoknkdgmh3fwwolesjqsbagrddgnmmrrqyiaaq5jq6yvw3uc6si
2026-05-01T18:21:47.651Z,2026-05-01T18:21:49.125Z,f de,studyzh.bsky.social,中国語学習に励む網走出身40代,did:plc:f5hehmi3oc2mfuksy76k5tgs,0,0,0,at://did:plc:f5hehmi3oc2mfuksy76k5tgs/app.bsky.feed.post/3mksqnqm73g27,bafyreihhahsr2zsj25yt5anwnknkomfhwl4g47udyp2qw37onjujhfh5ju
2026-05-01T18:21:42.018Z,2026-05-01T18:21:48.668Z,sem falar q a propria galera q f hoje nao entendeu a propria seriekk cansei de ver a galera falando quem escreveu os livros foi a hermione sendo q se vc conhece o minimo da personagem vc sabe q nem ela escreveria isso,luisemtpikah.bsky.social,luise cabezinha🏳️‍⚧️,did:plc:vjzzoi6bxld3gyj7clwhcamo,1,0,0,at://did:plc:vjzzoi6bxld3gyj7clwhcamo/app.bsky.feed.post/3mksqnl5yzc2m,bafyreih3uahovazky4jipsndkv4nnjo54ckcwho4m44r7ecl4epi7p56ey
2026-05-01T18:21:30.797Z,2026-05-01T18:21:47.722Z,was an invasion thwarted in 77 falklands operation journeyman 1977 and illegal occupation of southern thule,britbob1.bsky.social,,did:plc:gvvbgyk57kxflwpzpavuqlhm,0,0,0,at://did:plc:gvvbgyk57kxflwpzpavuqlhm/app.bsky.feed.post/3mksqnahlyc2z,bafyreibz73wg5z4xh4yvfjfh2zxtfyzgbyhyeeq2vm66giqvndd6jtcobq
2026-05-01T18:20:51.505Z,2026-05-01T18:20:53.076Z,1maggio che cos notizia manifestazioni lavoratori in tutta italia per lavoro dignitoso oppure sono pi importanti tafferugli a torino tg la 7 sceglie gli incidenti dicendo che un peccato abbiano oscurato giornata ma chi stabilisce lordine lo spirito santo o chi fa il tg giornalismo 2026,scenari.bsky.social,Roberto Reale,did:plc:5fvfcjtckeibzigkqm2r77wb,3,0,1,at://did:plc:5fvfcjtckeibzigkqm2r77wb/app.bsky.feed.post/3mksqm2yxk22j,bafyreiayqkwpocsz3qcm6vuhdscfstijjwizrii2p6omumzzhcsagtirie
2026-05-01T18:18:48.106Z,2026-05-01T18:18:49.575Z,haha den var god ai sliter med f hender riktig ja egentlig litt bra s man ser forskjell,fr0kenfaia.bsky.social,fr0kenfaia👽,did:plc:md5krlj5qhlbyt2twzfnfn3i,3,0,0,at://did:plc:md5krlj5qhlbyt2twzfnfn3i/app.bsky.feed.post/3mksqifcn3c2x,bafyreib6mw5gw6u4xp6zb6beamahhqwwwfjx355l5g54jyxxxf7erknc5i
2026-05-01T18:17:42.560Z,2026-05-01T18:17:42.877Z,mottok i dag en jobbs knad p sms h yst uventet f slik p sms spesielt siden eg ikke skal ansette noen men fant annonsen han s kte p og der stod mitt nummer som kontakt gitt,fredrik.nerdiverset.no,Fredrik,did:plc:dgp7zlpdkghki3ae5fotyupt,6,0,0,at://did:plc:dgp7zlpdkghki3ae5fotyupt/app.bsky.feed.post/3mksqggsgak2v,bafyreigigx6gyxjb2mhnts5am27m7p6z4z5tr5to6ra4u7hqfw5sfrj3kq
2026-05-01T18:17:15.928Z,2026-05-01T18:17:16.975Z,st ll samma fr ga om haymarket till hundra sossar och du kommer eventuellt f ett n stan korrekt svar de andra kommer hamna n nstans mellan ingen aning och den f rsta socialdemokratiska demonstrationen p f rsta maj en tradition som skurkarna i extremv nstern f rs kt stj la fr n oss,owallstromer.bsky.social,Skalman,did:plc:524qhrgsiotysfqluco53nw7,6,2,0,at://did:plc:524qhrgsiotysfqluco53nw7/app.bsky.feed.post/3mksqfnfmi72s,bafyreigph7wr34rsd6li25hn4hwnewzseys37nabtn6k24r7bytf5ry37m
2026-05-01T18:17:15.646Z,2026-05-01T18:17:15.176Z,eu n o sou muito f de gel ia ent o acabei n o pensando nisso mas realmente acho que d pra ler dessa forma eu tava pensando em tentar beber aqueles xaropes de suco de guaran sem gua mesmo,nintakun.bsky.social,Nintakun,did:plc:2pflm7g6j5qo6mvzia4i3og3,0,0,0,at://did:plc:2pflm7g6j5qo6mvzia4i3og3/app.bsky.feed.post/3mksqfn4y4c26,bafyreibqtqxoymn7ovugjxzxo7pg4eo6e5v54rg343ezfbxocrzl2unhga
2026-05-01T18:17:13.715Z,2026-05-01T18:17:14.373Z,i dont think the knvb dutch fa will require 133 games to be replayed even though itd be better if they did the logistical chaos would be too much to handle itll ruin the dutchs chances in the wc this summer better to either write the season off or impose bans for next,lifeofeldi.bsky.social,Eldi,did:plc:buy4rs3dnejrb77jvohze6l5,0,0,0,at://did:plc:buy4rs3dnejrb77jvohze6l5/app.bsky.feed.post/3mksqflc3ds2t,bafyreigm6apmlkptfdvm7j62cl2gw4pyuvb5d7lmbvv4fbpx76jp35shzq
2026-05-01T18:16:58.236Z,2026-05-01T18:17:03.575Z,pln frente amplio agenda ciudadana y pusc firman pacto pol tico de oposici n desc rguelo aqu o revisa una infograf a con un resumen ejecutivo del acuerdo pol tico culturacrnetplnfacacy,culturacr.bsky.social,CulturaCR Noticias,did:plc:zpl7mwjdmzceowbczfurmbei,1,0,0,at://did:plc:zpl7mwjdmzceowbczfurmbei/app.bsky.feed.post/3mksqf4jq4c2o,bafyreieqom76n7llwl3ho5vdfyihpzyhwvu62bl2a5s43as3pmiencsyji
