created_at,indexed_at,text,author_handle,author_display_name,author_did,like_count,repost_count,reply_count,uri,cid
2026-05-01T15:53:33.138Z,2026-05-01T15:53:33.471Z,wikipedia the diamond then changed hands between various empires in south and west asia until being given to queen victoria after the second anglosikh war and the british east india companys annexation of the punjab in 1849 i mean it was originally stolen just not by the uk for once,simulflow.bsky.social,Simulflow,did:plc:uezmlnxdeki5rcgwopvwoo3e,0,0,1,at://did:plc:uezmlnxdeki5rcgwopvwoo3e/app.bsky.feed.post/3mksieo2w5c2i,bafyreicyw6e27ldefnbms3rfffywg5nksg5izn3jpqxkt4d5ijrj6eec2m
2026-05-01T03:53:24.006Z,2026-05-01T03:53:27.876Z,10 the wrong trousers 1993 this is definitely one of the best stopmotion short films i ve ever watched it starts off comfortably and then gets more offthewall later on the climatic train chase sequence is a major animation flex and is just so damn funny beware of feathers mcgraw,coldhardcrash.bsky.social,CHC,did:plc:tj4hy5lgkjsi7ob4wrafbsrz,0,0,0,at://did:plc:tj4hy5lgkjsi7ob4wrafbsrz/app.bsky.feed.post/3mkra4wmzzs2y,bafyreia5dje4gcee4x5tz7d6kjweajwhoj6ptord5bn42wsc2k5jchzg3a
2026-05-01T01:30:50.972Z,2026-05-01T01:30:55.173Z,evening yall im now at 6061360 due tomorrow by 5pm edt for my shelter and safety during my birthday all is appreciated linktreekhernandez helpsky helpfolkslive2026 mutualaid disability fundsky bipocma helpblackwomen helpblackmages urgent,kswriteshere.bsky.social,KSWriteshere 🍉♊,did:plc:udzdncz54fsj2spg24u33wj2,20,27,0,at://did:plc:udzdncz54fsj2spg24u33wj2/app.bsky.feed.post/3mkqy5ztem22g,bafyreia3l7wxwnpobdkp2hkp4jiwirfijonxa4eqofahhedc7ii3enkcee
2026-05-01T00:55:38.866Z,2026-05-01T00:56:24.173Z,artists quote with your blue art,alex-the-ahsum.bsky.social,Alex The Ahsum,did:plc:5rrjdgk3kcdkez4namasxez7,9,2,0,at://did:plc:5rrjdgk3kcdkez4namasxez7/app.bsky.feed.post/3mkqw73l22s27,bafyreiauoskqcu674gjjfmfapidpmpclgwvc4fjkrhifofl453pytuprmm
2026-05-01T00:46:39.532Z,2026-05-01T00:46:50.974Z,if you ve been following a while you know i have the worst luck lol so in typ my life fashion i have pneumonia i still plan to power thru this film new content plus take gfe sexting sessions customs but we ll hold off on cam unless you don t mind that i sound like personal,submuchfun.bsky.social,Sammy Lee♥️(6/20) sub goal ($0/$100),did:plc:lbdjue7nuvhoo4l472uw7tgt,6,0,0,at://did:plc:lbdjue7nuvhoo4l472uw7tgt/app.bsky.feed.post/3mkqvoz7lw22v,bafyreihtcttdir774ese3vp43rt7c4rabrcndnvwvrmedhgz5k2aabn2j4
2026-04-30T23:12:54.251Z,2026-04-30T23:12:53.872Z,i mean if youre kinda dumb youll think that actually higher property values means you should buy high sell higher but diamond hands for ramat beit shemesh condos is a baffling message to include with come move here before they kill you all1,meatraffle.bsky.social,Mr. Miso Paste,did:plc:mtxxdvikghbwblsx2wf5crat,8,0,1,at://did:plc:mtxxdvikghbwblsx2wf5crat/app.bsky.feed.post/3mkqqhejjjs26,bafyreigv4ivctxaj3lbf5q76cksbeticaxc5cale4vx3iu7ivzkeanpcbq
2026-04-30T20:01:35.927Z,2026-04-30T20:01:39.273Z,a kind soul sent 5 bucks 2 days ago who can match or exceed i know full well they really didnt have it my ask is due tomorrow linktreekhernandez helpsky helpfolkslive2026 mutualaid disability fundsky bipocma blackmutualaid helpblackwomen helpblackmages,kswriteshere.bsky.social,KSWriteshere 🍉♊,did:plc:udzdncz54fsj2spg24u33wj2,5,5,0,at://did:plc:udzdncz54fsj2spg24u33wj2/app.bsky.feed.post/3mkqfrbwxok2g,bafyreigg7yfmfxr2afw5hzz3irh32pcmcn7vgsyb7jb62am2d5v5txge64
2026-04-30T17:35:57.703Z,2026-04-30T17:36:15.279Z,i misuse this post to recommend w dalrymples and a anands book on the history of this stone because it also tells the history of the people through whose hands the stone passed its a bit of everything political history social cultural its an easy read,kaffeehaus.bsky.social,Viola Tricolor,did:plc:egzqjsaownsf3r2zv3l3ni5y,5,0,1,at://did:plc:egzqjsaownsf3r2zv3l3ni5y/app.bsky.feed.post/3mkq5munftc2m,bafyreihr45gofkmemvmiopknzdtn7knviha7436df6eebyouzzp7nmw7ee
2026-04-30T16:37:36.645Z,2026-04-30T16:37:36.873Z,maybe diamond hands can defeat 6 diesel,jeradwalker.bsky.social,Jerad Walker,did:plc:4muri6zol4jwdltg2kdiu6vm,2,0,0,at://did:plc:4muri6zol4jwdltg2kdiu6vm/app.bsky.feed.post/3mkq2ejnmwc2q,bafyreihqdz7c7gmtkwjfnfks3bvdxr3c55ihxgpe7dnq7k445mesb2efkm
2026-04-30T15:07:17.791Z,2026-04-30T15:07:22.375Z,happy thankfulthursday yall im stalled at 5161360 for 2 days now this is due tomorrow by 5pm est please ampiify all you can please chip in all is appreciated helpsky helpfolkslive2026 mutualaid disability fundsky helpblackwomen,kswriteshere.bsky.social,KSWriteshere 🍉♊,did:plc:udzdncz54fsj2spg24u33wj2,14,17,1,at://did:plc:udzdncz54fsj2spg24u33wj2/app.bsky.feed.post/3mkpvczth7s2t,bafyreicnldiynyu2ywhmp2ayuycijw2rht67h5penigs6fawzak5k6ffpm
2026-04-30T14:45:43.095Z,2026-04-30T14:45:43.794Z,are you happy bokuto continues firm hands kneading into every part of akaashi s body that he can reach akaashi takes a hold of the yellow diamond that dangles from the clasp of his collar,bokkunutty.bsky.social,nutty °.•🦉💗🦉°.•,did:plc:yhigk2bzposs2wuh6ayjh4gp,4,0,1,at://did:plc:yhigk2bzposs2wuh6ayjh4gp/app.bsky.feed.post/3mkpu4h4xbs22,bafyreic522klu4i2lmxmiyggng3bih4c54isvukypwahzxdsv4wzslas64
2026-04-30T13:37:33.505Z,2026-04-30T13:37:33.076Z,keep it golden cuties im still resting and recovering my strength so no art streams this week have last years sexy bikini in the meantime,goblinidol.bsky.social,💎THOXA💚,did:plc:sl6jusqembyuqwa3ambf5hgf,2,2,0,at://did:plc:sl6jusqembyuqwa3ambf5hgf/app.bsky.feed.post/3mkpqckxzhs25,bafyreiern2eib7rab2xaonp7addruf4r2bystrzq6caqtbvzltjx4cpg2u
2026-04-30T10:21:39.097Z,2026-04-30T10:21:41.676Z,the black diamond and beyond hidden hands and healing lands our new education resource is designed to inspire learners to explore the industrial past present and future of wales the innovation and ethics theme interrogates who is celebrated or ignored in history,glamarchives.bsky.social,Glamorgan Archives Archifau Morgannwg,did:plc:7nl5mswmunepgv2dvba7iivm,1,1,1,at://did:plc:7nl5mswmunepgv2dvba7iivm/app.bsky.feed.post/3mkpfeb3vhc2o,bafyreibs6lklmim3jxxlh55o5ps2tt7n6yihw3xiz7awxy5r5q3kop2q6e
2026-04-30T10:18:15.389Z,2026-04-30T10:18:28.874Z,nsfwart overalls,sldkfjasd.bsky.social,pigeon man,did:plc:q4jstglqsio6y2tk7yvhk43h,834,108,6,at://did:plc:q4jstglqsio6y2tk7yvhk43h/app.bsky.feed.post/3mkpf66tatk2h,bafyreihkbalhsrasna6ghmcpdbllfzybb7zbxkm2nnwq63txi3a7ysmlom
2026-04-30T09:07:36.043Z,2026-04-30T09:07:38.275Z,260429 got a very exciting email in my inbox this eve the colours of the envelope may or may not hint as to where it s from week 17 complete pixelart dailyspritepc,pixelclipcreates.bsky.social,Pixel Clip,did:plc:gmnfsa6oxn6ckyks7yyny7st,14,0,0,at://did:plc:gmnfsa6oxn6ckyks7yyny7st/app.bsky.feed.post/3mkpb7tutfc2e,bafyreibe64jljn2ubwitxuwl7lwx3isaiejhw5ia756cdtyn57smvk57ei
2026-04-30T07:42:42.867Z,2026-04-30T07:42:46.772Z,also folks you are not prepared for the mascot of the brewery near here i know i wasn t,looeethetiger.bsky.social,Lughaidh the 🐅,did:plc:qqtwxq5qunimxkrdav4zrwbi,145,25,10,at://did:plc:qqtwxq5qunimxkrdav4zrwbi/app.bsky.feed.post/3mkp4i2nojc2v,bafyreiceua6vjo6jsc4ia2ju3n2cgutosy4uktuimrlbwtby4ac4z5kcay
2026-04-30T07:40:22.377Z,2026-04-30T07:40:41.172Z,gratuitous tattoo pictures and friends in conversation cyberpunk2077photomode cyberpunkvp virtualphotography ncitizens arsocvasa,ars-noctis.bsky.social,Max B.,did:plc:62xo4cshhu6muusbogc4s3qy,13,5,1,at://did:plc:62xo4cshhu6muusbogc4s3qy/app.bsky.feed.post/3mkp4durtj22u,bafyreih2x2qrdhjufwhcvf73znua6mfpczp5j65wzycpe5rgs4yjkfpk4e
2026-04-30T01:28:15.490Z,2026-04-30T01:28:15.273Z,shiva fight hands down the diamond dust heel click into the rest of the fight while oblivion plays was just too good there were fun moments before but that really solidified everything to me,p1pressstart.bsky.social,P1 Press Start,did:plc:454rwzo77htveweozmfmpnfk,0,0,0,at://did:plc:454rwzo77htveweozmfmpnfk/app.bsky.feed.post/3mkohki3cyk2q,bafyreiccjxmd2bgjv2brknor732thawmqaq674hdnvlylr2drbqqlzuhru
2026-04-30T00:40:52.739Z,2026-04-30T00:41:16.273Z,minecraftart blockbench mineimator i forgot to upload yesterday but heres some more renders from my innercircle of friends this time we got brandon and cassie joining yay oh berry suggested i use these specific tags so im using them lol,bubbledgaming.bsky.social,Bubbles,did:plc:i2u5y3yhhgmm2vhc4atqzebv,1,0,0,at://did:plc:i2u5y3yhhgmm2vhc4atqzebv/app.bsky.feed.post/3mkoevr5pos2z,bafyreiffokthuxr5vpcmmlrttjuawdp6vi43cjcb3m6iz7nc7b4rejxnti
2026-04-29T14:17:01.804Z,2026-04-29T14:17:06.177Z,diamond hands,agelston.bsky.social,Andrew Gelston,did:plc:hscx76sqr4x2ox7gh3gl4v4p,3,0,1,at://did:plc:hscx76sqr4x2ox7gh3gl4v4p/app.bsky.feed.post/3mknc2a3wjs2s,bafyreihz3qguba3wdvacqstekovvx2kopa327n7jyuhokqpbb64rwcsoeu
2026-04-29T14:06:33.747Z,2026-04-29T14:07:01.475Z,a girl reading araki from the bookshelf collection photography bnw blueskyartshow fineart conceptualart photooftheday bskysocial araki leica leicaq3monochrom leicacamera bookshelf,bluszcz.bsky.social,Bluszcz,did:plc:movwavh2an6x2gaqem2ar4re,20,2,1,at://did:plc:movwavh2an6x2gaqem2ar4re/app.bsky.feed.post/3mknbhjh6vs2x,bafyreidxrm5q4qtubcuh464wpdqdz5xrtpkghql2xggkiucpnsrv3s2vxq
2026-04-29T12:48:29.581Z,2026-04-29T12:48:33.172Z,new helmholtz open science seminar putting publishing back into the hands of the scientific community diamond open access at helmholtz may 7 2026 10 am to 1 pm more info here oshelmholtzdeveranstaltun registration gfzdezoomxdemeetingregi open to everyone,helmholtzosoffice.bsky.social,Helmholtz Open Science Office,did:plc:76pi5owknaw5zsxixoyvaqqb,0,0,0,at://did:plc:76pi5owknaw5zsxixoyvaqqb/app.bsky.feed.post/3mkn53vxqr22u,bafyreigbgtdwyp3jujgup6mb2obc2fxfzlqfabovcedmrkfppzvt2aavre
2026-04-29T08:38:51.518Z,2026-04-29T08:38:53.973Z,260428 got a lot of business bidness admin bits done today makes it feel like pixel clip creates is a bit more official now pixelart dailyspritepc,pixelclipcreates.bsky.social,Pixel Clip,did:plc:gmnfsa6oxn6ckyks7yyny7st,10,0,1,at://did:plc:gmnfsa6oxn6ckyks7yyny7st/app.bsky.feed.post/3mkmp5jrpxs2l,bafyreicp5zmewsmuqyudwa6o2g2zkppg5flrsdrtzfxkiqo3nzxosk3gpq
2026-04-29T04:25:23.597Z,2026-04-29T04:25:24.274Z,dannng my diamond art club order that was supposed to ship by april 30th thursday has been held up at customs in dallastx and now they estimate it arriving by may 30th they hope way before that just don t want to under estimate but it s completely out of their hands,sundropjo.bsky.social,SundropJo💜,did:plc:n6b3uoq6vq672z3avt2kj42f,3,0,0,at://did:plc:n6b3uoq6vq672z3avt2kj42f/app.bsky.feed.post/3mkmaycenqc2y,bafyreighqdavp3bueoojphfjhd7dy5uq53scuep4dzrjhic3izaqnh2p2q
2026-04-29T04:18:34.869Z,2026-04-29T04:18:43.076Z,devoshri is descended from a long line of jewel keepers to the maharaja when shes sent to the tower of london to watch over the kohinoor diamond in 1849 she must unleash the prophecy of the ravens to steal it back and enlist the help of their master questpit w a hf,ayishahhasni.bsky.social,Ayishah Hasni is querying and drafting a new WIP ✨✍🏾,did:plc:vb5pvh4qm7lz377xlti4gwfo,55,19,4,at://did:plc:vb5pvh4qm7lz377xlti4gwfo/app.bsky.feed.post/3mkmam4lcbk2a,bafyreicw3aj7v3xnrkfn25tsdqdfatkopcya7ro5vers2p3ti4urlhpzsu
2026-04-28T22:50:29.199Z,2026-04-28T22:50:29.473Z,the lyric you were born with a face for a missing sign is going to be a lyric i think about as often as i think about the lyric you wouldn t know a diamond if you held it in your hands and that s often,halleycomet3.bsky.social,Step,did:plc:ceuqipgomd2ib3i2cjhksqju,3,0,0,at://did:plc:ceuqipgomd2ib3i2cjhksqju/app.bsky.feed.post/3mklobguc6s23,bafyreibw3qtxweebxz7rjcvj4qwlbf6ehstxiko2pv5ghntgsod2qsfg5e
2026-04-28T12:07:01.000Z,2026-04-28T12:07:02.872Z,jacob crypto bury turns diamond hands into poker hands at coinpoker,arc-codex.com,Ross Nesbitt,did:plc:i2y34utl5i7yo34ymxxksmwo,0,0,0,at://did:plc:i2y34utl5i7yo34ymxxksmwo/app.bsky.feed.post/3mkkkcu7zuq26,bafyreifhbq6bog2fmszcqnwlb2hxljgsnelpys4igekpx6rbebnq6jpyzm
2026-04-28T09:26:11.000Z,2026-04-28T09:26:26.074Z,event 72nd helmholtz open science online seminar putting publishing back into the hands of the scientific community diamond open access at helmholtz and beyond may 7 2026 starting at 10am cest online helmholtz association of german research centres,oatp.fediscience.org.ap.brid.gy,Open Access Tracking Project,did:plc:pjmhmambaiyzrbqjqadqer26,0,0,0,at://did:plc:pjmhmambaiyzrbqjqadqer26/app.bsky.feed.post/3mkkbdfwt27x2,bafyreidjixcrjunwpntwjgsnjkyfhvc3svbgmcfemn2nqyfk4decaupx6a
2026-04-28T01:14:49.552Z,2026-04-28T01:14:48.057Z,when commercial llms go full unsubsidized then well see what companies and devs have diamond hands,jontaylor.bsky.social,Jon Taylor,did:plc:mzwsohunc7xx6tq6af7wxeug,0,0,0,at://did:plc:mzwsohunc7xx6tq6af7wxeug/app.bsky.feed.post/3mkjfumkk622q,bafyreiesllsus5jkx55w6z724awvfurs3bcjwfainbqikidcv6cuceyryu
2026-04-27T20:01:06.337Z,2026-04-27T20:01:07.259Z,i switched from skateboarding to snowboarding because it hurts a lot less when you fall but ill stop when you pry that deck from my cold dead hands actually thats probably exactly what will happen when my body is discovered after doing something fatally stupid on a double black diamond,broderick-m.bsky.social,❌👑 Michael B,did:plc:vua2qimo46gjtpap7vdega7z,1,0,0,at://did:plc:vua2qimo46gjtpap7vdega7z/app.bsky.feed.post/3mkiudndlc22s,bafyreihs3udespgusbhub3cn76ofl4zhxsunk7nap5ffkwqrvw4tnsy5py
2026-04-27T18:01:17.364Z,2026-04-27T18:01:17.865Z,im sure if lawn darts could prop up a speculative economy we wouldn t have been so hasty i m still diamond hands on my lawn darts stock,johngosland.bsky.social,John Gosland,did:plc:xru7u4lzdjjacy4paz5i6opy,1,0,0,at://did:plc:xru7u4lzdjjacy4paz5i6opy/app.bsky.feed.post/3mkinnffkt22z,bafyreib5svik6stlhkwqvxvyjwaynmvh7vrh4hpzhe6oju6z2uxfp257rq
2026-04-27T17:42:01.721Z,2026-04-27T17:42:03.259Z,ed marriage is for the straights teach,asneakyfox.bsky.social,fox 🏳️‍🌈🏴‍☠️,did:plc:juzsh5hjypeon536fj2dt3xd,46,3,2,at://did:plc:juzsh5hjypeon536fj2dt3xd/app.bsky.feed.post/3mkimkxc75s2p,bafyreif5xdzlsfp6zu74meqf7vsvnksnfhguuc7l3txxpgf7h5x3cuwxwi
2026-04-27T16:42:25.758Z,2026-04-27T16:42:28.362Z,gm all you nft collectors and diamond hands for monday motivation go to your nearest caf and get a flat white thank me later astro 36,astrosolhub.bsky.social,astrosolhub.bsky.social,did:plc:5ke6jsy56omtbasblagdxorc,0,0,0,at://did:plc:5ke6jsy56omtbasblagdxorc/app.bsky.feed.post/3mkijaeyftk2k,bafyreicqvltuncerb7knn5n6effzqxi6rvywzcwslcdnsbyjmtj43lreia
2026-04-27T06:25:35.825Z,2026-04-27T06:25:40.570Z,i mean,dangermuppet.bsky.social,"Dylan. fairly male, very metal",did:plc:nxnb2aaaplwhy4q7ogbdphfm,1,0,1,at://did:plc:nxnb2aaaplwhy4q7ogbdphfm/app.bsky.feed.post/3mkhgrfl2ys2a,bafyreieu4yvdhrgefxheqvfqxlvzs6hlfbswezjptyygeq4obm3ybphwsa
2026-04-26T20:27:32.941Z,2026-04-26T20:28:03.864Z,hello hello i am thanatos im an oc artist that talks far too much about my ocs i also love learning about other peoples ocs so so much this means you are free to yap to me about them thank you sage for hosting heres some of my recent stuff,look4stars.bsky.social,thanatos 💀⭐️,did:plc:wvvvymetmw4zhi3u5wyqlogw,3,1,0,at://did:plc:wvvvymetmw4zhi3u5wyqlogw/app.bsky.feed.post/3mkgfdyyhys2m,bafyreibdctkd4syjervvjeegn7k2sxiesdvtxk4eswxhlafvb2wtbl3tme
2026-04-26T19:01:31.326Z,2026-04-26T19:02:01.064Z,thank you for hosting sage im mera and i dabble in dnd ocs mainly as well as fantasy in general,inkychimera.bsky.social,Mera Mera ✨️ EMERGENCY COMS OPEN📌,did:plc:fa5h25yzrpcsrvbtd5ovmfud,29,10,3,at://did:plc:fa5h25yzrpcsrvbtd5ovmfud/app.bsky.feed.post/3mkgak6i6m623,bafyreifabu3bocroy2nvub3ruhcehkjs4vvoa3ccvm3p7kmuzrtaxag57m
2026-04-26T05:04:03.419Z,2026-04-26T05:04:08.457Z,cw blood i forgive you i forgive you i forgive you gposers gpose aysel wotn starlightstudios,starblessed.bsky.social,Aysel 🌌,did:plc:jovcju2tr54lzg5c7izzruax,32,14,3,at://did:plc:jovcju2tr54lzg5c7izzruax/app.bsky.feed.post/3mkerqodrv225,bafyreihmb3jacpqjqqc3x2nz4cgg62l4hlxxhvx67ekusmpviicgfrztym
2026-04-26T03:05:50.269Z,2026-04-26T03:05:52.356Z,cosmo when he winks little pixel characters appear to fight alongside him his hands when formed in a diamond formation cause beams to appear with his twin their powers combine and become stronger,roseheartkiss.bsky.social, 🎀🎻 Shu / Ray ♡,did:plc:4v4v4pxx46ilcmfdo5cyj2dy,2,0,1,at://did:plc:4v4v4pxx46ilcmfdo5cyj2dy/app.bsky.feed.post/3mkel5brzlk2d,bafyreiadehd6tph3ycojqgfovz4xac4cabb2fscylypwjn7c2ehbpqu26a
2026-04-25T23:57:47.642Z,2026-04-25T23:57:50.557Z,woman at the window by rik wouters 1915 owned by the flemish government on display at museum of art hof van busleyden mechelen belgium arthistory modernart fauvism,firstamendmentgirl.bsky.social,First Amendment Girl ,did:plc:gtvblttitvvita57xiqahrvh,7,2,1,at://did:plc:gtvblttitvvita57xiqahrvh/app.bsky.feed.post/3mkeamzttx22g,bafyreictnp3iparfmw23m2437gv7fohxcxtvy62hyofqzr7t43ifpfvuqq
2026-04-25T10:34:26.658Z,2026-04-25T10:34:26.798Z,despite bitcoin trading below its peak investors are demonstrating a longerterm allocation strategy often referred to as diamond hands,rwatimes.bsky.social,RWATimes.io,did:plc:553eofo6hvuxcsxo7qfidxjs,0,0,0,at://did:plc:553eofo6hvuxcsxo7qfidxjs/app.bsky.feed.post/3mkctqju6jt2q,bafyreicrowsiu2ntqx4hvp7azptvak2qf5vflkd6im2mwv5tqtkicoqjxm
2026-04-25T08:31:12.166Z,2026-04-25T08:31:15.359Z,my friend and i thought itd be fun to also trade at eorzealand so im printing more fanfestwoltrade stickers only 60 lol if you are attending and didnt get these stickers from my friend during the fanfest sticker exchange you can come up to me and ask to trade ill be wearing this tote,goopgoop.bsky.social,i love my baka chungus life,did:plc:6tudqaibcttfqt4hz4iism5n,0,0,2,at://did:plc:6tudqaibcttfqt4hz4iism5n/app.bsky.feed.post/3mkcmu5vhac2l,bafyreidorwp3wlzuv2ddfcqpbugavh344z2dgvqttorx2s5htuxotsicoa
2026-04-25T07:35:33.606Z,2026-04-25T07:35:55.160Z,decided to doodle a little idea i had way back in 2024 might draw her in more miraculous at some point cuz this was really fun hope yall like tmnt tmnt2012 apriloneil miraculousladybug art fanart,sarahdrawstuff.bsky.social,😺Dino💙 April O'Neil's #1 Solider,did:plc:kgjqtjjpjardpxoulv27vl6g,13,4,1,at://did:plc:kgjqtjjpjardpxoulv27vl6g/app.bsky.feed.post/3mkcjqnxvds2u,bafyreibjvbc2udm2cxuqnlse6vz764ap6blxcgotydmh56lwcbgmxmjmma
2026-04-24T14:48:50.463Z,2026-04-24T14:49:18.061Z,happy belated birthday and thank you for hosting the share and tysm to bskysocial for tagging me i love your art so much hi i m laura feral marker pen artist i m disabled audhd dysfunctional a mess but i love creating,lauramellinatelier.bsky.social, Laura Mellin,did:plc:6tst4qu25gqzh32sljvp3kek,6,3,0,at://did:plc:6tst4qu25gqzh32sljvp3kek/app.bsky.feed.post/3mkarij3mxc2u,bafyreigo4vb4nwnybh3onsxzt4mn5d7uqp2xktpylxjdcsdgi53xjce6aq
2026-04-24T14:05:35.586Z,2026-04-24T14:06:30.855Z,1080 snowboarding n64 1998 14,lowpolyhighres.bsky.social,📉𝙇𝙤𝙬-𝙋𝙤𝙡𝙮 📈𝙃𝙞𝙜𝙝-𝙍𝙚𝙨,did:plc:2tfijqu4eljrivk36wwtssk2,92,23,1,at://did:plc:2tfijqu4eljrivk36wwtssk2/app.bsky.feed.post/3mkap36evgs2k,bafyreib6ns7v7wpa2u2ta5airqrudupr5pjvvyacdy3bwjuw72ec5nazx4
2026-04-24T01:02:46.006Z,2026-04-24T01:03:06.558Z,love in the ring thanks bskysocial for commissioning to design my own ocs kljslhfldsf youre a real one maritimemayhem krownofthornz splatoon splatoonoc oc art vgencomm,yovillustar.bsky.social,«★yovi★» | vgen commissions open,did:plc:u7yz2aqblyh45llav7jt7jga,25,8,1,at://did:plc:u7yz2aqblyh45llav7jt7jga/app.bsky.feed.post/3mk7ddeow3k24,bafyreih6xmktytu6x4dmtzjwe24dwo3qskqiqkbvxh24nlbzjpbik44dpu
2026-04-24T00:48:02.465Z,2026-04-24T00:48:05.981Z,oh my hands and knees human resources is a diamond in the rough of netflix adult animation i will forever be devestated it only got 2 seasons s2 focuses on disability and heavily features the late alice wong voicing herself as a main character at least give this song a chance,wulfums.bsky.social,Allan and Klaus's Hubby @ ANE,did:plc:6bgzg4ply75xo6cu5srpwokn,3,0,1,at://did:plc:6bgzg4ply75xo6cu5srpwokn/app.bsky.feed.post/3mk7cj234c224,bafyreibbcybjnr34hrhy7z2oxxqbaib6qgjsclwkacdnjk2kbeacppvv4i
2026-04-24T00:25:51.767Z,2026-04-24T00:25:53.957Z,the most recent meme in your camera roll describes your mental state,literarybeardo.blacksky.app,The Bearded Educator,did:plc:orxqweu3wkapfapl5qhb6xig,3,0,0,at://did:plc:orxqweu3wkapfapl5qhb6xig/app.bsky.feed.post/3mk7bbezx4s23,bafyreihgxl6olhp5s6w6hzdjsryyf7jjbgyubgils2bo2sxkdu2osoo3su
2026-04-23T22:17:36.897Z,2026-04-23T22:17:37.355Z,diddid you just say i have soft hands youre not wrong im not in the diamond handed memestock reddit investor club,surfdudeken03.bsky.social,🏄🏼‍♂️Surfing The Law ⚖️,did:plc:7yf22nqtya3hl5fvxqtid3vs,0,0,1,at://did:plc:7yf22nqtya3hl5fvxqtid3vs/app.bsky.feed.post/3mk7242mn222t,bafyreih6n3xsikinyfvtnxelwq5d7pbvv5a4jub6oqa7luvqkac3ijx6qq
2026-04-23T14:24:14.734Z,2026-04-23T14:24:14.059Z,its only losing cause he lacked diamond hands,mosheroperandi.bsky.social,Keith,did:plc:kzsnqhdb3styakbudv3xtq4p,5,0,0,at://did:plc:kzsnqhdb3styakbudv3xtq4p/app.bsky.feed.post/3mk67nm7gpk2l,bafyreigxbnii6x7tfaavga7wgxh3zglg5efgxtyvbgb2frncu44gnwodxa
2026-04-23T04:40:08.876441Z,2026-04-23T04:40:10.061Z,parts 133 efta00160782jpg epsteinweb efta00160782 available in the ios app store now,epsteinweb.bsky.social,Epstein Web,did:plc:ndjyym3ihrqu3g25gdztefrv,1,0,0,at://did:plc:ndjyym3ihrqu3g25gdztefrv/app.bsky.feed.post/3mk56z6bmzl2o,bafyreihvzlzpd55fj55ky7movsb43ulle3q6aqecufp6s4sglee6lsmwye
2026-04-22T23:14:24.806Z,2026-04-22T23:14:35.659Z,a femme fatale ripe for any era wildcard oc comicbooks characterdesign supervillain worldbuilding comicart,jathanielprince.bsky.social,Jathaniel Prince,did:plc:ho6f2hn6hcscyhi6iop3xw3u,3,0,0,at://did:plc:ho6f2hn6hcscyhi6iop3xw3u/app.bsky.feed.post/3mk4msp76zs2m,bafyreidk7nf7rlv2azjzeen6wrja76igdmkwm6fb4gfbffettjckh5wt34
2026-04-22T18:19:25.216Z,2026-04-22T18:19:25.762Z,diamond hands,astrezh.bsky.social,Anton Strezhnev,did:plc:kxhn2g23z4wqmteq3ablziwj,1,0,0,at://did:plc:kxhn2g23z4wqmteq3ablziwj/app.bsky.feed.post/3mk44d7kfcs2x,bafyreigf4i2qga5pcdj6j5f6t2zvmoyleyci4tk3dcgzhvo736ymiawy4q
2026-04-22T11:11:12.604Z,2026-04-22T11:11:15.759Z,the black diamond and beyond hidden hands and healing lands our new education resource is designed to inspire learners to explore the industrial past present and future of wales the natural resources and wealth section explores the enormous geological wealth found in south wales,glamarchives.bsky.social,Glamorgan Archives Archifau Morgannwg,did:plc:7nl5mswmunepgv2dvba7iivm,6,1,1,at://did:plc:7nl5mswmunepgv2dvba7iivm/app.bsky.feed.post/3mk3efj64v222,bafyreidq2f6eke3lllbnhpanfknk5hq2zlrjqyxocqoeuqivrsngvanm6y
2026-04-22T06:32:24.948Z,2026-04-22T06:32:25.656Z,jade monkey peeling the skin off diamond fruit through jaded hands forest diamond pips returning to the dry land jade monkey why doesnt it rain the rain i pray it begins to fall once more as it did before vss365 jade,chrisandprose.bsky.social,Chris Andrews,did:plc:7mkptrccotnnqye43kofx6l5,10,2,0,at://did:plc:7mkptrccotnnqye43kofx6l5/app.bsky.feed.post/3mk2usygmcc2p,bafyreidyj7bcc2cwyxw55s4mcv3o7hlfboiz5a7o2seffndft7rgzliyum
2026-04-22T02:26:24.151Z,2026-04-22T02:26:25.859Z,annie blanche banks better known as tempest storm the queen of exotic dancers 1928 2021 along with lili st cyr sally rand and blaze starr ms storm was one of the bestknown burlesque performers of the 1950s 1960s and 1970s with a stage career spanning more than 60 years,ebadofsky.bsky.social,Eric Badofsky,did:plc:lkb7jivx7ahvl6xr3j45gunr,0,1,0,at://did:plc:lkb7jivx7ahvl6xr3j45gunr/app.bsky.feed.post/3mk2h33h3c22d,bafyreietcj6k7a232rv277pwldpa6yopjie7pyot7immcdlwpdfg46p434
2026-04-22T00:37:21.438Z,2026-04-22T00:37:22.259Z,welcome back diamond hands how was the moon,olenargy.bsky.social,Peronism with American Characteristics,did:plc:lxfc7etc2mbqrbig7ofwbq6j,3,0,0,at://did:plc:lxfc7etc2mbqrbig7ofwbq6j/app.bsky.feed.post/3mk2ay3szec24,bafyreiavgputkw7uyrvnb4udfybievhmadhvnuqi62nfquprfuywn55o3m
2026-04-21T16:56:12.035Z,2026-04-21T16:56:38.555Z,anyone ever see that interview where tobey maguire said he couldnt breathe during the kiss scene anyways skill issue heres day twooo of capril week tmnt rottmnt capril caprilweek2026,joyfuladorable.bsky.social,🌻Joyfully Sea🌊,did:plc:5lxa2egwshlnfn55l7wozvuq,12,4,0,at://did:plc:5lxa2egwshlnfn55l7wozvuq/app.bsky.feed.post/3mjzh7isxd22r,bafyreib7e5qapnncvfz5lwhu2lqkaqyghhfjjsxlxdevml3nl2kkcquvjm
2026-04-21T12:42:52.553Z,2026-04-21T12:42:55.158Z,wipsnips from my gladiator wip after a particularly hard day filled with getting hurt and the shadow of being whipped to death grazing rufus its dinner time at the ludus,maximejaz.bsky.social,Maxime Jaz🌈🏳️‍⚧️,did:plc:3csyos4r6apiglz5e7zw6lbp,19,1,0,at://did:plc:3csyos4r6apiglz5e7zw6lbp/app.bsky.feed.post/3mjyz2iurmk27,bafyreielia2d766mxwugtwowmsahclmgdzkmkhoxsm6ywo64zr5twftg7i
2026-04-21T08:27:22.847Z,2026-04-21T08:27:24.155Z,jade commands the rough hands of nebulas ocean s full of white diamond sands she snares as she smerks at the trap set by the heart of what the ocean s commands jade shes tough lady full of luna tickles shrouded in emerald hues no ship escapes her gaze vss365 jade,chrisandprose.bsky.social,Chris Andrews,did:plc:7mkptrccotnnqye43kofx6l5,16,3,0,at://did:plc:7mkptrccotnnqye43kofx6l5/app.bsky.feed.post/3mjykrncxtk2r,bafyreifh4qjlevgpx7shsg6eaosgyeg5i36gfgxw2glv5yqhznvg76ozdy
